headline,ticker,relevance
"Dollar Tree's Halloween Sales Were Scary Good, But There's A Twist",DLTR,0.96
This Discount Retailer Is the Latest to Get a Lift From Shoppers Searching for Deals,DLTR,0.12
"Dollar Tree Q3 Earnings & Sales Beat Estimates, Comps Rise 4.2%",DLTR,0.97
"Dollar Tree Is Back, More Upside Likely",DLTR,0.97
Dollar Tree posts better-than-expected third quarter earnings,DLTR,0.97
"Dollar Tree, Inc. (DLTR) Q3 2026 Earnings Call Transcript",DLTR,0.97
Dollar Tree Wins High-Income Value Shoppers,DLTR,0.95
Dollar Tree: A Surprising K-Shaped Economy Winner,DLTR,0.95
"Compared to Estimates, Dollar Tree (DLTR) Q3 Earnings: A Look at Key Metrics",DLTR,0.97
US Stocks Mixed; Dollar Tree Posts Upbeat Earnings,DLTR,0.97
Live Nasdaq Composite: Stocks Meander Amid Signals of Economic Uncertainty,DLTR,0.06
Stock Market Live December 3: S&P 500 (VOO) Falls As Job Losses Spook Street,DLTR,0.12
Stock Futures Higher Despite Dismal ADP Jobs Report,DLTR,0.05
"Dollar Tree Narrows Outlook as Quarterly Profit, Sales Rise",DLTR,0.97
"First Look: Airbus trims targets, AWS AI, AEO hikes outlook",DLTR,0.08
"Dollar Tree beats sales expectations, as consumers spend more on bargain items",DLTR,0.97
Dollar Tree Stock Rises After Earnings. The Retailer Closes Strong 2025 With a Bang.,DLTR,0.97
"Dollar Tree raises annual profit forecast, beats quarterly sales estimates",DLTR,0.97
"Dollar Tree, Inc. Reports Results for the Third Quarter Fiscal 2025",DLTR,0.97
"Dollar Tree, CrowdStrike And 3 Stocks To Watch Heading Into Wednesday",DLTR,0.95
Dollar General Q3 Earnings Preview: Remodels and Margins in Focus,DG,0.97
How To Earn $500 A Month From Dollar General Stock Ahead Of Q3 Earnings,DG,0.97
Five Below (FIVE) Q3 Earnings: Taking a Look at Key Metrics Versus Estimates,FIVE,0.96
Five Below (FIVE) Q3 Earnings and Revenues Top Estimates,FIVE,0.97
Five Below Increases Full-Year View for Second Consecutive Quarter,FIVE,0.97
"Five Below, Inc. Announces Third Quarter Fiscal 2025 Financial Results",FIVE,0.97
Are You Looking for a Top Momentum Pick? Why Five Below (FIVE) is a Great Choice,FIVE,0.95
Is Five Below (FIVE) Stock Outpacing Its Retail-Wholesale Peers This Year?,FIVE,0.95
"First Look: Airbus trims targets, AWS AI, AEO hikes outlook",FIVE,0.18
"INVESTOR ALERT: Investigation of Bath & Body Works, Inc. (BBWI) by Holzer & Holzer, LLC",BBWI,0.97
"Bath & Body Works, Inc. (BBWI) Presents at Morgan Stanley Global Consumer & Retail Conference 2025 Transcript",BBWI,0.97
1 Meme Stock to Avoid Like the Plague,KSS,0.05
Macy's Says Wealthier Shoppers Are Spending. It's Unclear That Will Last.,M,0.98
Macy's turnaround shows promise as sales climb to highest level in over 3 years,M,0.97
"Macy's, Inc. (M) Q3 2026 Earnings Call Transcript",M,0.97
Crude Oil Gains 1%; Macy's Reports Strong Q3 Results,M,0.96
Macy's stock: is it egregiously overbought after Q3 earnings?,M,0.96
"Dow Jones Today: Stocks Turn Higher as Investors Downplay Private Payrolls Decline, Report Microsoft Cutting AI Software Sales Quotas",M,0.05
"Macy's shares waver after profit forecast disappoints, sales exceed estimates",M,0.97
Macy's Stock Pushes Higher Despite Mixed Earnings Reaction,M,0.97
Macy's Ups FY25 View After Posting Q3 Earnings Beat & Y/Y Comps Growth,M,0.96
Macy's tries to capture bigger piece of holiday shopping traffic,M,0.95
Macy's (M) Q3 Earnings: Taking a Look at Key Metrics Versus Estimates,M,0.97
5 Undervalued Stocks With Low Price-to-Sales Ratios & Strong Momentum,M,0.05
"CRWD Falls on Earnings Beat, OKTA Withholds 2027 Guidance, Macy's (M) Earnings",M,0.95
Live Nasdaq Composite: Stocks Meander Amid Signals of Economic Uncertainty,M,0.05
Why Fast-paced Mover Macy's (M) Is a Great Choice for Value Investors,M,0.97
Stock Market Live December 3: S&P 500 (VOO) Falls As Job Losses Spook Street,M,0.12
"Macy's Blows Past Q3 Estimates--$40 Million Cut, 2.5% Sales Surge, and Up to $21.6B Forecast",M,0.97
"CORRECTING and REPLACING Macy's, Inc. Reports Third Quarter 2025 Results",M,0.97
Macy's (M) Q3 Earnings and Revenues Surpass Estimates,M,0.96
"Macy's earnings, OpenAI under pressure, Boeing's delivery outlook and more in Morning Squawk",M,0.96
"Macy's surprises Wall Street by reporting sales growth and a profit, but the stock pulls back",M,0.98
Macy's Posts Earnings Beat. The Stock Is Falling.,M,0.97
Macy's Lifts View After Sales Hit Highest Level in More Than Three Years,M,0.95
Macy's lifts annual targets again as turnaround efforts rekindle demand,M,0.97
"Macy's posts strongest growth in more than 3 years, but strikes cautious note on holidays",M,0.97
"Macy's, Inc. Reports Third Quarter 2025 Results",M,0.97
"Macy’s shares waver after profit forecast disappoints, sales exceed estimates",M,0.97
ReconAfrica shares jump after testing identifies hydrocarbon pay at Kavango West 1X well,M,0.02
Royalty Management Holdings to invest in SAGINT to advance blockchain-based commodity traceability,M,0.05
Macy's Gears Up For Q3 Print; Here Are The Recent Forecast Changes From Wall Street's Most Accurate Analysts,M,0.93
"Dollar Tree, CrowdStrike And 3 Stocks To Watch Heading Into Wednesday",M,0.12
Kroger's Earnings Are Coming. Affordability Is Key for the Grocer—and Consumers.,KR,0.97
"First Look: Airbus trims targets, AWS AI, AEO hikes outlook",BBY,0.06
"RH UNVEILS RH DETROIT, THE GALLERY IN BIRMINGHAM",RH,0.97
Eisai Presents New Data on the Continued and Expanding Benefit of LEQEMBI® (lecanemab-irmb) Maintenance Treatment in Early Alzheimer's Disease at the Clinical Trials on Alzheimer's Disease (CTAD) Conference 2025,BIIB,0.96
Biogen Inc. (BIIB) Presents at Piper Sandler 37th Annual Healthcare Conference Transcript,BIIB,0.96
Biogen Inc. $BIIB Stake Reduced by Fisher Asset Management LLC,BIIB,0.94
Incyte Reports Inducement Grant Under Nasdaq Listing Rule 5635(c)(4),INCY,0.95
Incyte Corporation (INCY) Presents at Evercore 8th Annual Healthcare Conference Transcript,INCY,0.97
Global Vitiligo Foundation Applauds Partnership Between Incyte and Winnie Harlow to Elevate Awareness and Understanding of Vitiligo,INCY,0.95
Arrowstreet Capital Limited Partnership Boosts Stock Position in Incyte Corporation $INCY,INCY,0.97
Why Is Exact Sciences (EXAS) Up 45.4% Since Last Earnings Report?,EXAS,0.98
T2 Biosystems (NASDAQ:TTOO) Shares Cross Above 50 Day Moving Average   – What’s Next?,TTOO,0.97
STRM.BIO Awarded ARPA-H Contract to Advance Megakaryocyte-Derived Vesicle Platform for In Vivo Cell Engineering and Gene Therapy,DNA,0.12
"Chevron to spend up to $19 billion next year in focus on US, Guyana oil production",CVX,0.97
Chevron Announces 2026 Capex Budget of $18 to $19 Billion,CVX,0.97
Chevron Initiates Discussions With Syria Over Oil and Gas Exploration,CVX,0.96
3 Top Dividend Stocks to Buy in December to Boost Your Passive Income in 2026,CVX,0.12
The 2 Best High-Yield Energy Stocks in Vanguard High Dividend Yield ETF,CVX,0.12
Chevron Lags Sector YTD - Can It Catch Up Before the Year-End?,CVX,0.94
"First Look: Airbus trims targets, AWS AI, AEO hikes outlook",CVX,0.12
Edgestream Partners L.P. Boosts Stock Position in Chevron Corporation $CVX,CVX,0.97
Why Is Diamondback (FANG) Up 11.9% Since Last Earnings Report?,FANG,0.95
Trade Tracker: Stephanie Link buys SLB,SLB,0.96
SLB Limited (SLB) is Attracting Investor Attention: Here is What You Should Know,SLB,0.97
AI needs power desperately. Here's how to invest in companies profiting from the pain.,DUK,0.62
Touchstone Value Fund Q3 2025 Portfolio Update,XEL,0.05
FirstEnergy Corporation $FE Shares Bought by Edgestream Partners L.P.,FE,0.95
American Century Companies Inc. Has $16.81 Million Stock Position in Consolidated Edison Inc $ED,ED,0.93
Building An Income Portfolio? 3 Picks To Start With For An Average Yield Of 6%+,VICI,0.12
Contrasting Gladstone Commercial (NASDAQ:GOOD) and VICI Properties (NYSE:VICI),VICI,0.94
Two Dividend Strategies Every Retiree Should Consider in 2026,O,0.18
Buy The Dip: 2 Blue-Chip Dividend Growth Stocks Getting Way Too Cheap,O,0.12
Realty Income Corp. (O) Up 2.4% Since Last Earnings Report: Can It Continue?,O,0.97
How to Build a Portfolio That Pays You Every Month,O,0.25
The Dividend Income Strategy That Helps You Sleep Better at Night,O,0.12
Realty Income Corporation (O) is Attracting Investor Attention: Here is What You Should Know,O,0.97
Building An Income Portfolio? 3 Picks To Start With For An Average Yield Of 6%+,O,0.12
This 5.6%-Yielding Dividend Stock Showcases the Power of its Diversified Platform with a New $800 Million Deal,O,0.12
"Edgestream Partners L.P. Sells 22,781 Shares of Realty Income Corporation $O",O,0.93
Electrify America and Simon® Collaboration Surpasses 500 Hyper-Fast Chargers,SPG,0.94
"Autolane Secures $7.4M in Funding, Launches Curbside Operating System at Simon® Centers to Transform Retail Curbs for Autonomous Vehicle Era",SPG,0.95
1832 Asset Management L.P. Lowers Holdings in American Tower Corporation $AMT,AMT,0.96
Digital Realty Announces Redemption of 2.500% Guaranteed Notes due 2026,DLR,0.95
AI needs power desperately. Here's how to invest in companies profiting from the pain.,DLR,0.78
Airbus Cuts 2025 Delivery Target,TGT,0.07
Target Hospitality Announces Multi-Year Contract Diversifying Customer Base and Expanding Regional Presence,TGT,0.03
Target Corporation $TGT Shares Bought by Arrowstreet Capital Limited Partnership,TGT,0.95
CI Investors Have Opportunity to Join The Cigna Group Fraud Investigation with the Schall Law Firm,CI,0.95
New Cigna Research Shows Purpose Can Offset Chronic Disease,CI,0.95
New report from Oliver Wyman and Association of Equipment Manufacturers finds rising uncertainty is reshaping equipment manufacturing,MMC,0.1
Zoetis Inc. $ZTS Shares Purchased by Arrowstreet Capital Limited Partnership,ZTS,0.96
Trump touts rollback of fuel standards. Here's why it ‘won't suddenly make cars cheaper.,F,0.82
Trump Administration Lowers Fuel-Economy Rules For Carmakers,F,0.82
Trump to propose sharp rollback in US vehicle fuel economy rules,F,0.93
What's Behind Ford's EV Sales Plunge of 60% in November?,F,0.97
Ford's EV Plans Ruined,F,0.96
"Tesla Rival Rivian Sees 24% Sales Surge In November Amid CEO RJ Scaringe's EV Credit Comments, Elon Musk-Style Pay Package",F,0.18
"Gilead Sciences, Inc. (GILD) Presents at Evercore 8th Annual Healthcare Conference Transcript",GILD,0.95
"Gilead Sciences, Inc. (GILD) Presents at Citi Annual Global Healthcare Conference 2025 Transcript",GILD,0.97
AT&T Drops DEI To Push Spectrum Deal Forward,T,0.94
Building An Income Portfolio? 3 Picks To Start With For An Average Yield Of 6%+,T,0.1
"Altria Group, Inc. (NYSE: MO) Price Prediction and Forecast 2025-2030 (December 2025)",MO,0.97
Headline ADP Payrolls Number Comes in Negative,ADP,0.95
ADP Disappoints: -32K Private Sector Jobs Last Month,ADP,0.97
"Apple stock up 7 straight sessions, ADP reports 32,000 private payroll jobs lost in November",ADP,0.94
Gold price jumps as ADP says 32K jobs lost in November,ADP,0.96
ADP Jobs Report Shows Surprise Drop In Private Payrolls; S&P 500 Futures Rise,ADP,0.97
"ADP National Employment Report: Private Sector Employment Shed 32,000 Jobs in November; Annual Pay was Up 4.4%",ADP,0.97
CVS Health Corporation (CVS) is Attracting Investor Attention: Here is What You Should Know,CVS,0.95
Arrowstreet Capital Limited Partnership Raises Holdings in CVS Health Corporation $CVS,CVS,0.94
Southern Company Pledges Steady Customer Rates Through 2027,SO,0.97
DevvStream and Southern Energy Renewables Announce Business Combination Targeting Low-Cost Production of Carbon-Negative SAF and Green Methanol,SO,0.05
A Major Markets Operator Suffered a Technical Glitch That Left Traders Scrambling. Should You Be Worried?,CME,0.12
LSEGY or CME: Which Is the Better Value Stock Right Now?,CME,0.95
"1832 Asset Management L.P. Sells 695,627 Shares of CME Group Inc. $CME",CME,0.96
Can AXP Keep Its ROE Shining While Expenses Climb the Ladder?,AXP,0.96
How to Build a Portfolio That Pays You Every Month,AXP,0.06
KLA Corporation (KLAC) Presents at UBS Global Technology and AI Conference 2025 Transcript,KLAC,0.97
Equinix Implements Finance Leadership Succession Plan as CFO Keith Taylor Plans to Retire,EQIX,0.96
AI needs power desperately. Here's how to invest in companies profiting from the pain.,EQIX,0.66
"Here Are Wednesday’s Top Wall Street Analyst Upgrades and Downgrades: American Eagle Outfitters, Equinix, Garmin, Honeywell, Uber, Wendy’s and More",EQIX,0.97
"Why The PNC Financial Services Group, Inc (PNC) is a Top Value Stock for the Long-Term",PNC,0.97
Chubb 2025 Wealth Survey: The Resilient Mindset,CB,0.92
"Regeneron Pharmaceuticals, Inc. (REGN) Presents at Citi Annual Global Healthcare Conference 2025 Transcript",REGN,0.95
"Here Are Wednesday’s Top Wall Street Analyst Upgrades and Downgrades: American Eagle Outfitters, Equinix, Garmin, Honeywell, Uber, Wendy’s and More",REGN,0.05
"Edgestream Partners L.P. Has $5.45 Million Stock Holdings in Regeneron Pharmaceuticals, Inc. $REGN",REGN,0.95
"Are WM Stock Investors Happy, or Did They Miss Out?",WM,0.97
Here's Why You Should Consider Investing in Parker-Hannifin Now,PH,0.95
Ecolab Inc. $ECL Shares Purchased by Edgestream Partners L.P.,ECL,0.97
Ecolab Inc. $ECL Position Lessened by Arrowstreet Capital Limited Partnership,ECL,0.953
Illinois Tool Works Inc. $ITW Shares Purchased by American Century Companies Inc.,ITW,0.95
Why Is Vertex (VRTX) Up 2.7% Since Last Earnings Report?,VRTX,0.97
Vertex Pharmaceuticals Incorporated (VRTX) Presents at Citi Annual Global Healthcare Conference 2025 Transcript,VRTX,0.94
"Vertex Up 9.2% in 3 Months: Should You Buy, Sell or Hold the Stock?",VRTX,0.95
2 Brilliant Growth Stocks to Buy Now and Hold for the Long Term,VRTX,0.05
Touchstone Value Fund Q3 2025 Portfolio Update,AIG,0.05
"First Look: Airbus trims targets, AWS AI, AEO hikes outlook",WFC,0.08
Illumina (ILMN) Moves to Strong Buy: Rationale Behind the Upgrade,ILMN,0.96
"Constellation Brands: A High-Quality Business Facing Temporary Problems, or Something Worse?",STZ,0.95
Arrowstreet Capital Limited Partnership Raises Stock Position in Constellation Brands Inc $STZ,STZ,0.96
Edwards Lifesciences Corporation $EW Shares Sold by Fisher Asset Management LLC,EW,0.95
"American Century Companies Inc. Sells 1,049,818 Shares of Edwards Lifesciences Corporation $EW",EW,0.93
Archer-Daniels-Midland Company (ADM) Presents at Goldman Sachs Industrials and Materials Conference 2025 Transcript,ADM,0.96
New Strong Sell Stocks for Dec.3,ADM,0.12
American Century Companies Inc. Has $18.80 Million Stock Holdings in Archer Daniels Midland Company $ADM,ADM,0.93
Fisher Asset Management LLC Decreases Holdings in Baker Hughes Company $BKR,BKR,0.95
Northrop Grumman Corporation $NOC Shares Purchased by Arrowstreet Capital Limited Partnership,NOC,0.94
Prudential Financial Announces Matt Armas as Chief Investment Officer,PRU,0.96
"Prudential Advisors Connect mobile app launches, bringing advisor productivity tools to iOS devices, further enhancing the advisor experience",PRU,0.937
Idexx (IDXX) Up 1.5% Since Last Earnings Report: Can It Continue?,IDXX,0.95
"The Travelers Companies, Inc. $TRV Shares Sold by Arrowstreet Capital Limited Partnership",TRV,0.95
"SHAREHOLDER ALERT Bernstein Liebhard LLP Announces A Securities Fraud Class Action Lawsuit Has Been Filed Against Fiserv, Inc. (NASDAQ: FISV)",FISV,0.95
"Fiserv execs bet $1.5 million on a turnaround, and the stock pops",FISV,0.95
"Strong Black Friday Sales Highlight an Otherwise Flat November, According to Fiserv Small Business Index",FISV,0.93
Buy the Spike in Marvell Technology Stock After Q3 Earnings?,MRVL,0.97
Beyond NVIDIA: 5 Semiconductor Stocks Set to Dominate 2026,MRVL,0.2
Earnings Beat: Marvell Technology Acquires Celestial AI,MRVL,0.96
Marvell Could See AI Revenue Double By 2028 Thanks To New Tech Deal: Analysts,MRVL,0.96
"Today's Market: Dow Rises, Nasdaq Slides as Microsoft Sparks Fresh AI Selloff",MRVL,0.12
Why Marvell Technology Stock Popped Today,MRVL,0.95
Marvell Technology Analysts Raise Their Forecasts Following Upbeat Q3 Earnings,MRVL,0.97
"Marvell Could Hit $10B Next Year, CEO Says — And AI Demand Is Just Getting Started",MRVL,0.96
"Dow Jones Today: Stocks Turn Higher as Investors Downplay Private Payrolls Decline, Report Microsoft Cutting AI Software Sales Quotas",MRVL,0.22
This Semiconductor Stock Is Surging After an AI Deal and Strong Earnings,MRVL,0.12
Marvell's Strategic AI Moves Boost Stock Despite In-Line Earnings,MRVL,0.97
"Marvell Technology Q3 Earnings Beat Estimates, Revenues Rise Y/Y",MRVL,0.97
"Bulls Target Chip Stock After Earnings, Acquisition",MRVL,0.12
"Marvell reports record Q3 revenue, raises data center growth outlook",MRVL,0.97
"Wall Street Analysts Still Love Marvell, Amazon, and Broadcom",MRVL,0.95
Marvell Earnings Just Confirmed The Optical Supercycle,MRVL,0.95
Live Nasdaq Composite: Stocks Meander Amid Signals of Economic Uncertainty,MRVL,0.12
"As Marvell's stock rises on an upbeat forecast, analysts still have these questions",MRVL,0.95
5 Things to Know Before the Stock Market Opens,MRVL,0.07
"Marvell Post Q3: Can't Beat Them, Join Them (Rating Upgrade)",MRVL,0.97
Stock Market Live December 3: S&P 500 (VOO) Falls As Job Losses Spook Street,MRVL,0.06
"Marvell: Cheap Today, Critical To Tomorrow's AI Data Centers",MRVL,0.95
"Marvell Technology to Acquire Celestial AI for $3.25 Billion, Lifts Outlook for Next Fiscal Year",MRVL,0.97
Stock Futures Higher Despite Dismal ADP Jobs Report,MRVL,0.1
"MRVL Rallies, CRWD Earnings, AEO Upgrade",MRVL,0.95
"First Look: Airbus trims targets, AWS AI, AEO hikes outlook",MRVL,0.07
Marvell's XPU Wars Begin - A Q3 Update (Rating Downgrade),MRVL,0.97
1 Artificial Intelligence Stock That Could Double in 2026,MRVL,0.12
Marvell: Q3 Earnings Showcase The Next AI Infrastructure Cornerstone,MRVL,0.93
Marvell shares jump as chipmaker bolsters AI ambitions with Celestial deal,MRVL,1.0
Marvell Technology (NASDAQ:MRVL) Trading 2% Higher  on Better-Than-Expected Earnings,MRVL,0.98
Marvell Technology to acquire Celestial AI for $3.25B,MRVL,0.97
LULU Q3 EPS Preview: Are Shares Stretched to the Downside Enough?,LULU,0.95
lululemon athletica inc. (LULU) is Attracting Investor Attention: Here is What You Should Know,LULU,0.97
Align Technology Showcases Digital Dentistry Innovations at Greater New York Dental Meeting 2025,ALGN,0.95
"Align Technology, Inc. (ALGN) Presents at Evercore 8th Annual Healthcare Conference Transcript",ALGN,0.96
Wall Street Punished CrowdStrike for Beating Earnings? Seriously?,CRWD,0.98
"CRWD Security ""Bellwether,"" Cybersecurity ""Must for Companies to Survive""",CRWD,0.96
"CrowdStrike Holdings, Inc. (CRWD) Presents at UBS Global Technology and AI Conference 2025 Transcript",CRWD,0.97
Why Nike (NKE) Outpaced the Stock Market Today,NKE,0.97
"Nike Before Q2: The Turnaround Story Everyone Wants, But Still Can't Quite See",NKE,0.96
Can NIKE Stay Ahead as Global Sportswear Faces Tariff Headwinds?,NKE,0.95
UK Bans Nike Ads Over Green Claims,NKE,0.93
Wall Street Breakfast Podcast: Nike Makes Big 'Sport Offense' Roster Moves,NKE,0.95
"Fisher Asset Management LLC Has $35 Million Stock Holdings in NIKE, Inc. $NKE",NKE,0.95
Rivian recalls 35K delivery vans over defective seat belts that could fail in crashes,RIVN,0.96
Boomers Seeking Passive Income Are Buying 5 Safe High-Yield Monthly Pay ETFs,RIVN,0.05
Rivian Automotive (NASDAQ: RIVN) Stock Price Prediction for 2025: Where Will It Be in 1 Year (Dec 3),RIVN,0.97
"Tesla Rival Rivian Sees 24% Sales Surge In November Amid CEO RJ Scaringe's EV Credit Comments, Elon Musk-Style Pay Package",RIVN,0.97
"Rivian To Recall 34,824 Vehicles After Seatbelt Failure Warning",RIVN,0.97
"Rivian Automotive, Inc. $RIVN Shares Bought by Edgestream Partners L.P.",RIVN,0.96
"Rivian to recall nearly 35,000 US vehicles over seatbelt issue, says NHTSA",RIVN,0.97
"Lucid Group, Inc. (LCID) Presents at UBS Global Industrials and Transportation Conference Transcript",LCID,0.96
Can LCID Stock Beat the Market?,LCID,0.97
"Final Trade: GM, ULTA, NFLX, BWA",GM,0.96
Monthly information on share capital and company voting rights,GM,0.12
Trump touts rollback of fuel standards. Here's why it ‘won't suddenly make cars cheaper.,GM,0.62
Trump's South Korea tariff cuts are major boost for Hyundai and GM,GM,0.96
GM has hired a former Tesla exec in its revived self-driving push,GM,0.97
Trump Administration Lowers Fuel-Economy Rules For Carmakers,GM,0.86
General Motors Company (GM) Presents at UBS Global Industrials and Transportation Conference Transcript,GM,0.97
GM or FSS: Which Is the Better Value Stock Right Now?,GM,0.94
Trump to propose sharp rollback in US vehicle fuel economy rules,GM,0.82
Arrowstreet Capital Limited Partnership Lowers Position in General Motors Company $GM,GM,0.95
Genmab Announces Closing of Private Offering of Senior Secured Notes and Senior Unsecured Notes,GMAB,0.97
Enphase: This Fallen Angel Has A Sneaky AI Thesis,ENPH,0.95
Uber Technologies ($UBER) | Archer Aviation ($ACHR) | Enphase Energy ($ENPH) | EVgo ($EVGO),ENPH,0.95
PayPal shares fall as CFO flags weaker holiday-quarter spending trends,PYPL,0.96
PayPal Casinos USA 2025: High 5 Casino Voted Leading Casino for PayPal,PYPL,0.92
"PayPal Holdings, Inc. (PYPL) Presents at UBS Global Technology and AI Conference 2025 Transcript",PYPL,0.97
PayPal Stock Drops. The CFO Delivers a Sobering Outlook.,PYPL,0.97
Building An Income Portfolio? 3 Picks To Start With For An Average Yield Of 6%+,PYPL,0.12
Shopify Inc. (SHOP) Presents at UBS Global Technology and AI Conference 2025 Transcript,SHOP,0.97
"2 Growth Stocks to Invest $1,000 In Right Now",SHOP,0.12
Why Pay More? AppLovin Delivers Better Than Shopify,SHOP,0.96
Net Stock Forecast: How Much Could Cloudflare Shares Drop?,NET,0.97
Cloudflare and AWS Keep Breaking the Internet,NET,0.97
"MongoDB, Inc. (MDB) Presents at UBS Global Technology and AI Conference 2025 Transcript",MDB,0.97
"First Look: Airbus trims targets, AWS AI, AEO hikes outlook",MDB,0.12
MongoDB: Good Q3 But Not A Buy Now (Rating Upgrade),MDB,0.95
Here's What Key Metrics Tell Us About Snowflake (SNOW) Q3 Earnings,SNOW,0.97
Snowflake Inc. (SNOW) Q3 Earnings and Revenues Surpass Estimates,SNOW,0.97
Why Snowflake's earnings beat isn't enough to lift its stock,SNOW,0.95
Snowflake Narrows Loss as Revenue Climbs,SNOW,0.97
"Without Earnings, Snowflake, Other Big Software Companies Don't Make Cut for S&P 500",SNOW,0.95
"Snowflake Doubles AWS Marketplace Growth YoY, Eclipses $2 Billion in Sales as New Integrations Accelerate Enterprise Data and AI Adoption",SNOW,0.97
Snowflake and Anthropic Announce $200 Million Partnership to Bring Agentic AI to Global Enterprises,SNOW,0.96
Snowflake Reports Financial Results for the Third Quarter of Fiscal 2026,SNOW,0.97
Live: Snowflake (SNOW) Q3 Earnings Coverage,SNOW,0.96
Snowflake Earnings Are Imminent; These Most Accurate Analysts Revise Forecasts Ahead Of Earnings Call,SNOW,0.94
Options Corner: SNOW Ahead of Earnings,SNOW,0.98
"First Look: Airbus trims targets, AWS AI, AEO hikes outlook",SNOW,0.28
Snowflake Set To Beat Q3 Estimates Based On Insider Leaks: Leading Analysts Remain Bullish,SNOW,0.96
Snowflake (NYSE:SNOW) Shares Up 3.1% on Analyst Upgrade,SNOW,0.97
Datadog: Multiproduct Sales And AI Deals Underpin Strong Growth (Upgrade),DDOG,0.97
"Datadog Announces Expanded Collaboration Agreement, Highlights New Capabilities with AWS Across AI, Observability and Security at AWS re:Invent",DDOG,0.97
Okta CEO Sees Big Opportunity in AI,OKTA,0.96
Okta: Excuses to Sell Vs. Reasons to Buy,OKTA,0.95
Okta's Q3 Results: Strong Performance but Limited Visibility for FY27,OKTA,0.96
"Okta reports Q3 revenues and earnings above expectations, raises full-year guidance",OKTA,0.99
Okta (OKTA) Q3 Earnings: How Key Metrics Compare to Wall Street Estimates,OKTA,0.97
"CRWD Falls on Earnings Beat, OKTA Withholds 2027 Guidance, Macy's (M) Earnings",OKTA,0.96
Okta Deserves The Post-Earnings Slump (Rating Upgrade),OKTA,0.96
Here's Why Zoom Communications (ZM) is a Strong Growth Stock,ZM,0.97
Is This the Best Way to Invest in AI Without Betting on Chip Stocks?,PLTR,0.12
Could This Be a Golden Opportunity to Buy Palantir Stock at Under $170?,PLTR,0.97
Prediction: This AI Software Stock Could Outperform Every Chip Stock in 2026,PLTR,0.12
Palantir Stock Finds Its Footing—and a Path to Global Growth,PLTR,0.95
Palantir Technologies (NASDAQ: PLTR) Stock Price Prediction for 2025: Where Will It Be in 1 Year,PLTR,0.97
Will Palantir Be a $1 Trillion Stock by 2030?,PLTR,0.94
Why Wall Street May Be Completely Misunderstanding This AI Stock,PLTR,0.12
"1832 Asset Management L.P. Acquires 301,355 Shares of Palantir Technologies Inc. $PLTR",PLTR,0.97
UiPath (PATH) Q3 Earnings and Revenues Beat Estimates,PATH,0.97
Why UiPath Stock Is Soaring in After-Hours Trading,PATH,0.97
UiPath Stock Jumps After Q3 Earnings: Here's Why,PATH,0.97
UiPath Reports Third Quarter Fiscal 2026 Financial Results,PATH,0.97
Is This the Best Way to Invest in AI Without Betting on Chip Stocks?,PATH,0.12
Is Affirm Stock Yesterday's News?,AFRM,0.95
Coinbase to Participate in 53rd Annual Nasdaq London Investor Conference,COIN,0.95
"National Cryptocurrency Association, Coinbase, and Operation HOPE Announce New initiative to Empower Communities Through Crypto Literacy",COIN,0.96
"First Look: Airbus trims targets, AWS AI, AEO hikes outlook",COIN,0.06
"1832 Asset Management L.P. Invests $151.03 Million in Coinbase Global, Inc. $COIN",COIN,0.97
Buy 3 Crypto-Centric Stocks as Bitcoin Shows Signs of Steady Rebound,HOOD,0.27
The Best S&P 500 Stock Has Been In The Index Less Than 3 Months,HOOD,0.1
"Edgestream Partners L.P. Sells 59,361 Shares of Robinhood Markets, Inc. $HOOD",HOOD,0.95
Should You Buy Robinhood Stock After Its Recent Correction? The Answer Might Surprise You,HOOD,0.95
Netflix acquisition of Warner Bros. studio and HBO Max would face stiff DOJ antitrust opposition: sources,WBD,0.96
