headline,ticker,relevance
"If You'd Invested $100 in Palantir Stock 1 Year Ago, Here's How Much You'd Have Today",PLTR,0.97
"I Am Calling It: Palantir, Not OpenAI, Is Winning The AI Race",PLTR,0.96
Palantir Technologies Inc. (PLTR) Recently Broke Out Above the 20-Day Moving Average,PLTR,0.95
Palantir Technologies Inc. (PLTR) Just Overtook the 50-Day Moving Average,PLTR,0.97
Why analysts are flagging these two big AI winners as ‘Sell': here's what to know,PLTR,0.12
Prediction: 3 Stocks That'll Be Worth More Than Tesla 5 Years From Now,PLTR,0.06
"Down 11%, Is Palantir a Buy on the Dip?",PLTR,0.95
Billionaire Stanley Druckenmiller Sold His Fund's Entire Stakes in Nvidia and Palantir for a Scorching-Hot Drug Stock That's Up 218% Since Mid-2023,PLTR,0.94
"The Zacks Analyst Blog Palantir, Snowflake, Datadog, Atlassian and Zoom Communications",PLTR,0.95
UiPath (PATH) Outperforms Broader Market: What You Need to Know,PATH,0.95
"UiPath, Inc. (PATH) is Attracting Investor Attention: Here is What You Should Know",PATH,0.97
"Affirm Q1 Earnings Beat on Rising Active Merchants, Stock Up 15%",AFRM,0.97
"Is Trending Stock Affirm Holdings, Inc. (AFRM) a Buy Now?",AFRM,0.97
Coinbase Calls Off Acquisition of Stablecoin Startup BVNK,COIN,0.97
Best Momentum Stocks to Buy for Nov. 11,HOOD,0.05
"Is Most-Watched Stock Robinhood Markets, Inc. (HOOD) Worth Betting on Now?",HOOD,0.95
FedEx Corporation (FDX) Presents at Baird 55th Annual Global Industrial Conference Transcript,FDX,0.97
"Here are Tuesday's Top Wall Street Analyst Research Calls: Coreweave, Instacart, Qorvo, Robinhood Markets, Skyworks Solutions, Viasat and More",HOOD,0.97
"New Strong Buy Stocks for Nov. 11: HOOD, TCMD, and More",HOOD,0.95
Is MARA Holdings Stock Still a Buy After a Post-Earnings Drop?,MARA,0.95
BTU Announces Flow Through Financing,BTU,0.95
Is Warner Bros. Discovery Calling It Quits?,WBD,0.96
"Is Trending Stock Warner Bros. Discovery, Inc. (WBD) a Buy Now?",WBD,0.95
Does Disney Stock Have More Upside as Q4 Results Approach?,DIS,0.98
"Disney Q4 Preview: Will Investors Overlook YouTube Dispute, Box Office Setbacks For Future Guidance & Growth?",DIS,0.97
Recent IPO Earnings In Focus The Final Peak Week Of The Q3 Season,DIS,0.12
Disney Q4 2025 Preview: Searching for Growth Beyond Stability,DIS,0.97
Disney's blackout with YouTube TV sparks punishing $30M in weekly losses for Mouse House: analysts,DIS,0.96
Why Walt Disney (DIS) is a Top Momentum Stock for the Long-Term,DIS,0.95
Disney-YouTube TV Battle Highlights Huge Changes In Media Business,DIS,0.95
The Price of a Standoff: Disney's Losses (Or Wins) from the YouTube TV Blackout,DIS,0.96
How To Earn $500 A Month From Disney Stock Ahead Of Q4 Earnings,DIS,0.96
"Bank of America CEO seeks to meet Mayor-elect Mamdani, Fox News says",FOX,0.95
Top Streaming Stocks Positioned to Gain From Expanding Content Trends,ROKU,0.22
"Global Report Surveying 40,000 People Finds Live Music Is the World's Favorite Form of Entertainment",LYV,0.83
Market Today: SoftBank exits Nvidia; Ford doubles on EVs,LUV,0.05
Airlines warn flight cancellations will continue even after shutdown,LUV,0.82
Airlines warn flight cancellations will continue even after shutdown,JBLU,0.62
Market Today: SoftBank exits Nvidia; Ford doubles on EVs,AAL,0.08
US airlines grapple with shutdown fallout as Thanksgiving nears,AAL,0.77
Teck Resources analysts reveal possible mystery suitors ahead of Anglo American merger,AAL,0.03
Airlines warn flight cancellations will continue even after shutdown,AAL,0.78
"FedEx Projects Earnings Growth, Operational Resilience Ahead of Holiday Season",FDX,0.97
Zacks Industry Outlook United Parcel Service and FedEx,FDX,0.94
CoreWeave Surges in Q3 but Adjusts FY25 Outlook Amid Delivery Delays,MSFT,0.18
"Top Analysts See S&P 500 Climbing 7,500 by 2026 on AI Momentum",MSFT,0.25
What Is One of the Best Tech Stocks to Own for the Next 5 Years?,MSFT,0.12
Microsoft: Why You'll Regret Selling Now (It's Not What You Think),MSFT,0.96
Microsoft to Invest Over $10 Billion to Expand AI Infrastructure in Portugal,MSFT,0.96
Microsoft to pay dividends on December 11; Here's how much 100 MSFT shares will earn,MSFT,0.97
"Microsoft plans to invest $10 billion in Portugal AI data hub, Bloomberg News reports",MSFT,0.95
3 No-Brainer AI Stocks to Buy Right Now,MSFT,0.12
Alpine Woods Capital Investors LLC Cuts Stock Holdings in Microsoft Corporation $MSFT,MSFT,0.94
Apple and Microsoft Join Nvidia in the $4 Trillion Club. Here's How You Can Buy All 3 Growth Stocks for as Little as $1.,MSFT,0.95
Microsoft Corporation $MSFT Shares Purchased by Axxcess Wealth Management LLC,MSFT,0.94
Founders Grove Wealth Partners LLC Boosts Stock Holdings in Microsoft Corporation $MSFT,MSFT,0.96
"Boston Trust Walden Corp Sells 45,614 Shares of Microsoft Corporation $MSFT",MSFT,0.93
"Amazon cuts 700 jobs in NYC alone on quest to streamline by slashing 30,000 positions",AMZN,0.96
"Amazon is probably an AI winner, says Evercore's Mark Mahaney",AMZN,0.95
Amazon (AMZN) is a Top-Ranked Growth Stock: Should You Buy?,AMZN,0.97
Amazon Prime Video Ad-Supported Reach Hits 315M Monthly Viewers,AMZN,0.95
5 Stocks to Buy Despite a Subdued Holiday Shopping Forecast This Year,AMZN,0.12
"AMZN, AAPL and GOOG Forecast – Major US Stocks Quiet in Premarket",AMZN,0.95
"Crux Wealth Advisors Has $5.04 Million Position in Amazon.com, Inc. $AMZN",AMZN,0.97
"Amazon.com, Inc. $AMZN Shares Purchased by Forvis Mazars Wealth Advisors LLC",AMZN,0.93
"Community Bank of Raymore Has $677,000 Position in Amazon.com, Inc. $AMZN",AMZN,0.93
"Amazon.com, Inc. $AMZN Shares Acquired by Dumont & Blake Investment Advisors LLC",AMZN,0.95
"Cidel Asset Management Inc. Boosts Stock Holdings in Amazon.com, Inc. $AMZN",AMZN,0.94
"Amazon.com, Inc. $AMZN Shares Bought by Chicago Partners Investment Group LLC",AMZN,0.95
"Eos Management L.P. Sells 11,898 Shares of Amazon.com, Inc. $AMZN",AMZN,0.95
"Calamos Wealth Management LLC Acquires 26,975 Shares of Amazon.com, Inc. $AMZN",AMZN,0.94
Is Amazon's Cloud Business Actually Thriving? Some Data Tells a Different Story.,AMZN,0.96
Nov. 19 Will Be a Big Day for Nvidia. Should You Buy or Sell the Stock Now?,NVDA,0.96
SoftBank shares plunge as much as 10% after selling Nvidia stake,NVDA,0.82
Nvidia (NVDA) Stock Slides as Market Rises: Facts to Know Before You Trade,NVDA,0.97
S&P 500 Gains & Losses Today: Chip Stocks Slide as SoftBank Sells Nvidia Stake; Paramount Skydance Pops,NVDA,0.97
Market Today: SoftBank exits Nvidia; Ford doubles on EVs,NVDA,0.96
"3 Chip Stocks Sinking Alongside Nvidia: LRCX, MRVL, WDC",NVDA,0.95
"SoftBank's Nvidia exit fuels OpenAI push despite mounting losses, stiff competition from Anthropic",NVDA,0.93
"SoftBank's Nvidia sale rattles market, raises questions",NVDA,0.97
SoftBank Exits NVIDIA—So What? Analysts Still See More Upside,NVDA,0.96
Recent IPO Earnings In Focus The Final Peak Week Of The Q3 Season,NVDA,0.05
"AI trade in focus on Wall Street as SoftBank sells Nvidia stake, AMD Investor Day preview",NVDA,0.95
Nvidia Stock Slips. This Big Investor Sold Its Stake in the AI Chip Maker.,NVDA,0.97
SoftBank Says It Sold Its Entire Nvidia Stake. The Chip Stock is Sliding.,NVDA,0.98
Softbank sells entire $5.8B Nvidia stake as it goes ‘all in' on OpenAI bet,NVDA,0.97
Nvidia Shares Drop After SoftBank Sells Stake,NVDA,0.95
"CoreWeave CEO Addresses Data-Center Delay, Supply Chain and Nvidia",NVDA,0.93
SoftBank Sells $5.8 Billion Stake in Nvidia to Pay for OpenAI Deals,NVDA,0.97
CoreWeave Tumbles on Q3 Results; Nvidia Slips After SoftBank Stake Sale | Stock Movers,NVDA,0.95
"Top Analysts See S&P 500 Climbing 7,500 by 2026 on AI Momentum",NVDA,0.82
"Softbank sells entire stake in Nvidia, the health of the AI trade, flight cancellations mount",NVDA,0.97
Nvidia (NVDA) Crossed Above the 20-Day Moving Average: What That Means for Investors,NVDA,0.95
"Timing Inflation & Jobs Data, FOMC Impact & SoftBank's NVDA Sale ""Bullish""",NVDA,0.94
Nvidia stock slip after SoftBank sells $5.83B stake to fund OpenAI bet,NVDA,0.96
Nvidia Stock To $260?,NVDA,0.97
Nvidia: Global Alliances Are A Potential 'Liberation' From U.S. AI Cycles,NVDA,0.97
"Pre-Bell Playbook: Small Business Optimism Falls, Softbank Exits NVDA Position",NVDA,0.95
"Wall Street Loves Nike, NVIDIA and Instacart",NVDA,0.94
SoftBank's $5.8 billion Nvidia stake sale stirs fresh AI bubble fears,NVDA,0.95
Nvidia Shares Dip 2% After SoftBank Sells Entire Stake,NVDA,0.97
SoftBank sells entire Nvidia stake for $5.8B to fund expanding AI investments,NVDA,0.95
Why analysts are flagging these two big AI winners as ‘Sell': here's what to know,NVDA,0.12
Why SoftBank Is Ditching Nvidia for ChatGPT,NVDA,0.95
"Paramount cuts costs, SoftBank sells its Nvidia stake, Warren Buffett's new tradition and more in Morning Squawk",NVDA,0.94
"Here are Tuesday's Top Wall Street Analyst Research Calls: Coreweave, Instacart, Qorvo, Robinhood Markets, Skyworks Solutions, Viasat and More",NVDA,0.05
NVIDIA (NASDAQ: NVDA) Price Prediction and Forecast 2025-2030 for November 11,NVDA,0.97
3 Data Memory Stocks Beating NVDA This Year,NVDA,0.94
"Wall Street Breakfast Podcast: Dream Home, Lifetime Loan",NVDA,0.05
Softbank Dumps 100% of Nvidia Shares,NVDA,0.98
This Nvidia stock just crashed 10%,NVDA,0.97
This company just dumped $5.8 billion of Nvidia stock,NVDA,0.96
SoftBank fully cashed out its Nvidia stake for an even bigger AI bet,NVDA,0.96
SoftBank Sells Nvidia Stake for $5.8 Billion to Fund AI Bets,NVDA,0.95
Nvidia-backed CoreWeave's shares fall as data center delay hits annual revenue forecast,NVDA,0.78
Apple and Microsoft Join Nvidia in the $4 Trillion Club. Here's How You Can Buy All 3 Growth Stocks for as Little as $1.,NVDA,0.97
"Carmel Capital Partners LLC Acquires 1,888 Shares of NVIDIA Corporation $NVDA",NVDA,0.96
"Dale Q Rice Investment Management Ltd Sells 10,264 Shares of NVIDIA Corporation $NVDA",NVDA,0.97
"Chevy Chase Trust Holdings LLC Sells 135,725 Shares of NVIDIA Corporation $NVDA",NVDA,0.94
Foster & Motley Inc. Trims Stock Position in NVIDIA Corporation $NVDA,NVDA,0.96
NVIDIA Corporation $NVDA Shares Acquired by AssuredPartners Investment Advisors LLC,NVDA,0.95
SoftBank sells its entire stake in Nvidia for $5.83 billion,NVDA,0.95
"Turkcell, Google sign cooperation agreement on cloud technologies",GOOGL,0.95
"Google pledges €5.5B for German cloud, AI and office expansion",GOOGL,0.97
"Top Analysts See S&P 500 Climbing 7,500 by 2026 on AI Momentum",GOOGL,0.12
Earnings Growth & Price Strength Make Alphabet (GOOGL) a Stock to Watch,GOOGL,0.97
Google says it will invest around $6.4 billion in cloud infrastructure in Germany,GOOGL,0.96
"AMZN, AAPL and GOOG Forecast – Major US Stocks Quiet in Premarket",GOOGL,0.95
"Alphabet: Quietly Dominating AI, One Layer At A Time",GOOGL,0.97
The Price of a Standoff: Disney's Losses (Or Wins) from the YouTube TV Blackout,GOOGL,0.94
"Google to invest mid-single-digit billion amount in Germany, says industry source",GOOGL,0.96
Why Meta's Post-Earnings Selloff Is An Early Gift (Rating Upgrade),META,0.95
Meta AI Pioneer Has Discussed Leaving to Launch a Startup,META,0.94
LeCun's Exit Deals a Blow to Meta's AI Ambitions Amid Cost Pressures,META,0.97
Nebius Set To Join Meta And Oracle In The AI Debt Club,META,0.95
Latest Meta AI exit raises big questions for Zuckerberg's superintelligence push,META,0.95
Meta's chief AI scientist reportedly departing to launch own AI startup,META,0.94
Nebius Group Faces Capacity Challenges Despite Strong Revenue Growth,META,0.06
"Nebius: Microsoft, Then Meta - Now What?",META,0.93
CoreWeave Surges in Q3 but Adjusts FY25 Outlook Amid Delivery Delays,META,0.12
"Top Analysts See S&P 500 Climbing 7,500 by 2026 on AI Momentum",META,0.18
Nebius inks $3B AI infrastructure deal with Meta Platforms,META,0.97
Meta's top AI scientist Yann LeCun to depart as Mark Zuckerberg pushes ‘superintelligence',META,0.96
Meta's chief AI scientist Yann LeCun reportedly plans to leave to build his own startup,META,0.95
Is META Stock Set For A Bounce?,META,0.97
"Facebook co-founder Chris Hughes on U.S. industrial & tariff policies, AI data center investment",META,0.92
Why Is Wall Street So Bearish on Meta? There's 1 Key Reason.,META,0.97
"Yann LeCun exit: Meta chief AI scientist leaving to launch AI startup, FT reports",META,0.98
"AI cloud firm Nebius signs $3 billion deal with Meta, posts more than four-fold rise in revenue",META,0.97
"Meta chief AI scientist Yann LeCun plans to exit to launch startup, FT reports",META,0.94
3 No-Brainer AI Stocks to Buy Right Now,META,0.12
"Fisher Funds Management LTD Sells 27,194 Shares of Meta Platforms, Inc. $META",META,0.95
"Creative Financial Designs Inc. ADV Acquires 109 Shares of Meta Platforms, Inc. $META",META,0.95
"Meta Platforms, Inc. $META Shares Acquired by BLB&B Advisors LLC",META,0.96
"Meta Platforms, Inc. $META Shares Acquired by Cottage Street Advisors LLC",META,0.93
"Meta Platforms, Inc. $META is Bordeaux Wealth Advisors LLC’s 10th Largest Position",META,0.93
"Coign Capital Advisors LLC Buys 100 Shares of Meta Platforms, Inc. $META",META,0.95
"Adell Harriman & Carpenter Inc. Grows Position in Meta Platforms, Inc. $META",META,0.97
Meta: I'm Not Sweating A Drop After The Post Q3 Earnings Selloff,META,0.97
Could Buying Tesla Today Set You Up for Life?,TSLA,0.95
Market Today: SoftBank exits Nvidia; Ford doubles on EVs,TSLA,0.78
"Overlooked Stock: XPEV ""Dark Horse"" in EV & Robotics, Races Against TSLA",TSLA,0.82
Tesla Vs. XPeng: Musk's Optimus Meets Xiaopeng's Iron In The AI Race,TSLA,0.96
Tesla: Still A Strong Buy (On Pullbacks),TSLA,0.97
"As Tesla doubles down on AI, this analyst says its stock has gotten harder to recommend",TSLA,0.93
Tesla turns to $60-a-day rentals as US sales slump after EV tax credit expires,TSLA,0.97
Tesla Stock Is Slipping Today as Investors Eye Chinese Sales Numbers,TSLA,0.97
Tesla stock slides over 2%: what's hurting the EV stock today,TSLA,0.96
"Top Analysts See S&P 500 Climbing 7,500 by 2026 on AI Momentum",TSLA,0.25
EV Face-Off: Tesla's Scale vs. QuantumScape's Battery Vision,TSLA,0.94
Xpeng stock set for breakout as management takes aim at Tesla's AI ambitions,TSLA,0.82
Tesla China Sales Hit 3-Year Low,TSLA,0.97
Wall Street Price Prediction: Tesla's Share Price Forecast for 2025,TSLA,0.97
Ford CEO says taking apart Tesla and Chinese EVs was 'shocking' and pushed him to shake up the automaker,TSLA,0.95
Tesla's new plan to get cars out of showrooms takes on Hertz,TSLA,0.97
Prediction: 3 Stocks That'll Be Worth More Than Tesla 5 Years From Now,TSLA,0.93
Here's What Tesla Stock Looks Like In 10 Years If Musk Succeeds,TSLA,0.97
Tesla Or Bust? GM Stock A Better Ride,TSLA,0.93
"Advyzon Investment Management LLC Has $1.59 Million Stock Position in Tesla, Inc. $TSLA",TSLA,0.96
"Broadcom Inc. to Announce Fourth Quarter and Fiscal Year 2025 Financial Results on Thursday, December 11, 2025",AVGO,0.97
"Eli Lilly drops CVS drug plan for workers after Novo obesity deal, Bloomberg News reports",LLY,0.93
Why cutting drug prices is pushing Eli Lilly's stock toward an all-time high,LLY,0.97
"Lilly Up 18% in a Month: Should You Buy, Sell or Hold the Stock?",LLY,0.97
Three Healthcare Buys That Wall Street Loves,LLY,0.12
Market Today: SoftBank exits Nvidia; Ford doubles on EVs,JPM,0.1
"JPMorgan employs 120 at digital retail bank in Germany, to grow over time",JPM,0.94
JPMorgan Chase & Co. (JPM) Is a Trending Stock: Facts to Know Before Betting on It,JPM,0.97
Center for Financial Planning Inc. Sells 243 Shares of JPMorgan Chase & Co. $JPM,JPM,0.95
"Fisher Funds Management LTD Sells 7,662 Shares of JPMorgan Chase & Co. $JPM",JPM,0.94
Everest Management Corp. Boosts Stock Holdings in JPMorgan Chase & Co. $JPM,JPM,0.94
JPMorgan Chase & Co. $JPM Stock Position Lowered by Cottage Street Advisors LLC,JPM,0.95
JPMorgan Chase & Co. $JPM Holdings Lessened by Aviance Capital Partners LLC,JPM,0.95
"Cooke & Bieler LP Sells 4,717 Shares of JPMorgan Chase & Co. $JPM",JPM,0.937
Bridgewealth Advisory Group LLC Acquires New Shares in JPMorgan Chase & Co. $JPM,JPM,0.92
"Balentine LLC Has $754,000 Stock Position in JPMorgan Chase & Co. $JPM",JPM,0.94
Crescent Sterling Ltd. Has $4.55 Million Stake in JPMorgan Chase & Co. $JPM,JPM,0.94
Critical Analysis: Charles Schwab (NYSE:SCHW) & JPMorgan Chase & Co. (NYSE:JPM),JPM,0.97
"Visa and Mastercard reach proposed settlement with US merchants, ending decades-long fee dispute",V,0.97
24.7% of Warren Buffett's $315 Billion Portfolio at Berkshire Hathaway Is Invested in These 2 Unstoppable Stocks,V,0.05
Visa Unveils 2025 Creator Report; Introduces Creator Agent Pilot with Karat,V,0.94
Visa Inc. $V Shares Purchased by Americana Partners LLC,V,0.97
Altman Advisors Inc. Has $2.66 Million Stake in Visa Inc. $V,V,0.95
Alpha Cubed Investments LLC Has $25.59 Million Stock Holdings in Visa Inc. $V,V,0.95
Market Today: SoftBank exits Nvidia; Ford doubles on EVs,MA,0.08
"Visa and Mastercard reach proposed settlement with US merchants, ending decades-long fee dispute",MA,0.97
"EMCD Launches Global Crypto Payment Card, Enabling Everyday Spending Anywhere Mastercard Is Accepted",MA,0.82
"Final Trade: UNH, OIH, AMD, BMY",UNH,0.95
UnitedHealth Group Incorporated (UNH) Presents at UBS Global Healthcare Conference 2025 Transcript,UNH,0.95
2 Dividend Stocks to Double Up on Right Now,UNH,0.12
"Americana Partners LLC Sells 19,941 Shares of UnitedHealth Group Incorporated $UNH",UNH,0.95
Home Depot (HD) Beats Stock Market Upswing: What Investors Need to Know,HD,0.96
Home Depot (HD) Earnings Expected to Grow: What to Know Ahead of Next Week's Release,HD,0.96
"FOR VETERANS DAY, MEALS ON WHEELS AMERICA AND THE HOME DEPOT FOUNDATION CELEBRATE 4,000 HOMES MADE SAFER FOR SENIOR VETERANS",HD,0.94
Market Today: SoftBank exits Nvidia; Ford doubles on EVs,MRK,0.02
"49 Wealth Management LLC Sells 3,660 Shares of Merck & Co., Inc. $MRK",MRK,0.93
AbbVie Has Many Bullish Attributes (Technical Analysis),ABBV,0.95
Three Healthcare Buys That Wall Street Loves,ABBV,0.12
5 Top Stocks to Buy in November,ABBV,0.06
Costco Wholesale Corporation (COST) Period Ending/ Trading Statement Call Prepared Remarks Transcript,COST,0.97
"Costco Stock Is Flat as the Year Comes to a Close. Is That a Signal to Buy, or a Signal to Sell?",COST,0.95
Costco's New Polarizing Policy Is Making the Company Bank -- Though Not All Members Are Happy About It,COST,0.96
WATCH WHAT THEY DO: BofA's Moynihan says spending is still strong,BAC,0.97
"Bank of America CEO seeks to meet Mayor-elect Mamdani, Fox News says",BAC,0.95
"Americana Partners LLC Buys 7,956 Shares of Bank of America Corporation $BAC",BAC,0.95
Blackbird jumps 13% to 2.44p as former Adobe product lead joins elevate.io board,ADBE,0.07
Coca-Cola's Premium Price Tag: Is the Stock Still Worth Buying?,KO,0.97
My 3 Favorite Stocks to Buy Right Now,KO,0.12
Meet the 2 Words That Could Define 2026 Stock Market Returns,KO,0.07
5 Dividend Stocks That Could Double Your Passive Income Next Year,PEP,0.12
PepsiCo Slips Below 50-Day SMA: Bargain Opportunity or Red Flag?,PEP,0.96
2 Dividend Stocks to Double Up on Right Now,PEP,0.25
"Alpha Cubed Investments LLC Sells 1,608 Shares of PepsiCo, Inc. $PEP",PEP,0.93
Oracle (ORCL) Stock Declines While Market Improves: Some Information for Investors,ORCL,0.95
Nebius Set To Join Meta And Oracle In The AI Debt Club,ORCL,0.96
Oracle Rises 44.5% YTD on Cloud Strength: Buy the Stock Now or Hold?,ORCL,0.97
Oracle: Cloud Momentum And Heavy AI Investment Turn A 30% Slide Into Opportunity,ORCL,0.95
Recent IPO Earnings In Focus The Final Peak Week Of The Q3 Season,CSCO,0.1
Cisco Systems Q1 Preview: Analyst Says AI Demand Driving 'Multi-Year Growth Cycle',CSCO,0.94
Accenture and Apptio Team Up with PPL to Unlock Deeper Technology Spending Insights,ACN,0.96
Essity Collaborates with Accenture and Microsoft to Accelerate Adoption of AI Agents to Drive Productivity and Growth,ACN,0.95
"The Zacks Analyst Blog Accenture, Sanofi and Dell",ACN,0.95
Salesforce.com (CRM) Rises Higher Than Market: Key Facts,CRM,0.97
Salesforce Bets Big on Agentforce: Will Adoption Drive Revenues?,CRM,0.97
ShiftUp Announces ShiftUp AI Revenue Intelligence on Salesforce AppExchange,CRM,0.78
Johnson Fistel Investigates Fairness of Proposed Sale of Metsera,PFE,0.07
Where Will Pfizer Be in 3 Years?,PFE,0.97
5 Highest Yielding Dividend Stocks in the S&P 500,PFE,0.12
Who's Winning the Intense Battle to Rule the White-Hot GLP-1 Drug Market?,PFE,0.18
Why a Strong Quarter Wasn't Enough to Send Shares of Pfizer Soaring,PFE,0.96
Where Will Walmart Stock Be in 1 Year?,WMT,0.97
Pfizer Inc. (PFE) Discusses Clinical Development Strategy for 4404 Bispecific Antibody in Oncology Transcript,PFE,0.97
‘ROCKSTAR CEO': Why veteran trader says AMD's Lisa Su is ‘special',AMD,0.96
"Final Trade: UNH, OIH, AMD, BMY",AMD,0.93
Here's where AMD stands as AI competition heats up,AMD,0.96
Market Today: SoftBank exits Nvidia; Ford doubles on EVs,AMD,0.12
"Key takeaways from AMD's analyst day, plus economic damage of the govt shutdown",AMD,0.97
Data centers are 47% of AMD's business: CEO,AMD,0.96
AMD Unveils Strategy to Lead the $1 Trillion Compute Market and Accelerate Next Phase of Growth,AMD,0.97
AMD: 2 More Reasons To Buy After Earnings,AMD,0.95
AMD: Ride The OpenAI Wave,AMD,0.96
Lisa Su announces more than $1T forecast for AMD's total addressable market,AMD,0.96
AMD's Lisa Su sees 35% annual sales growth driven by 'insatiable' AI demand,AMD,0.97
Recent IPO Earnings In Focus The Final Peak Week Of The Q3 Season,AMD,0.12
"AI trade in focus on Wall Street as SoftBank sells Nvidia stake, AMD Investor Day preview",AMD,0.94
AMD analysts lower expectations ahead of Analyst Day,AMD,0.96
AMD's analyst day is just hours away. Can it power the stock even higher?,AMD,0.97
BXM Wealth LLC Decreases Holdings in NVIDIA Corporation $NVDA,NVDA,0.94
"Curbstone Financial Management Corp Sells 49,858 Shares of NVIDIA Corporation $NVDA",NVDA,0.94
Citizens Business Bank Has $26.97 Million Stake in NVIDIA Corporation $NVDA,NVDA,0.97
"The Big 3: GOOGL, AAPL, TSM",GOOGL,0.94
Market Today: SoftBank exits Nvidia; Ford doubles on EVs,V,0.05
These Mega Tech Giants Generate Robust Cash,AAPL,0.18
Market Today: SoftBank exits Nvidia; Ford doubles on EVs,AAPL,0.06
"Apple's minimal AI spend may lead to big gaps in competition, says Big Technology's Alex Kantrowitz",AAPL,0.93
"The Big 3: GOOGL, AAPL, TSM",AAPL,0.95
Apple reportedly pulls plug on iPhone Air 2 after weak sales of debut model,AAPL,0.97
"Prana Labs Secures $150K to Advance Vayu, Its AI-Guided Breathwork and Mindful Technology Platform",AAPL,0.05
What Will Drive Apple Stock's Next Big Move?,AAPL,0.96
"AMZN, AAPL and GOOG Forecast – Major US Stocks Quiet in Premarket",AAPL,0.96
24.7% of Warren Buffett's $315 Billion Portfolio at Berkshire Hathaway Is Invested in These 2 Unstoppable Stocks,AAPL,0.81
Apple and Microsoft Join Nvidia in the $4 Trillion Club. Here's How You Can Buy All 3 Growth Stocks for as Little as $1.,AAPL,0.95
Courage Miller Partners LLC Has $1.75 Million Stock Holdings in Apple Inc. $AAPL,AAPL,0.93
Cascade Investment Advisors Inc. Has $3.79 Million Stock Holdings in Apple Inc. $AAPL,AAPL,0.96
Apple Inc. $AAPL Stock Holdings Decreased by Community Bank N.A.,AAPL,0.97
"Elmwood Wealth Management Inc. Sells 1,506 Shares of Apple Inc. $AAPL",AAPL,0.95
Apple Inc. $AAPL is Astoria Portfolio Advisors LLC.’s 9th Largest Position,AAPL,0.95
"Envestnet Portfolio Solutions Inc. Purchases 13,785 Shares of Apple Inc. $AAPL",AAPL,0.97
Apple Inc. $AAPL Stake Raised by Concord Asset Management LLC VA,AAPL,0.94
Apple Inc. $AAPL Stock Position Raised by Endowment Wealth Management Inc.,AAPL,0.95
Delaney Dennis R Purchases 696 Shares of Apple Inc. $AAPL,AAPL,0.97
These Mega Tech Giants Generate Robust Cash,MSFT,0.12
Microsoft: I've Doubled Down During This AI Shakeout,MSFT,0.97
Microsoft Brings $10 Billion AI Data Center to Portugal's Coast,MSFT,0.97
Nebius Group Faces Capacity Challenges Despite Strong Revenue Growth,MSFT,0.05
"Nebius: Microsoft, Then Meta - Now What?",MSFT,0.95
Amgen Stock: New All-Time Highs Ahead After Earnings Beat,AMGN,0.97
"The Zacks Analyst Blog Morgan Stanley, Union Pacific, The Southern and Aware",MS,0.94
Lockheed Martin Corporation (LMT) is Attracting Investor Attention: Here is What You Should Know,LMT,0.97
Medtronic (MDT) Laps the Stock Market: Here's Why,MDT,0.94
The Bear Cup That's Causing Brawls at Starbucks,SBUX,0.95
Starbucks Baristas Have Voted To Strike Next Thursday On ‘Red Cup Day',SBUX,0.95
Starbucks Bids Adieu to China. Why It Could Boost the Stock.,SBUX,0.96
"Investors Heavily Search Intuitive Surgical, Inc. (ISRG): Here is What You Need to Know",ISRG,0.97
Citi CEO: We worry about credit decisions that smaller players will be making,C,0.96
Citi CEO: 'The U.S. economy continues to defy the tariff doomsdayers',C,0.93
"Citi CEO Jane Fraser: Some of the hype of in AI is earned, some of it is 'exuberant'",C,0.95
"Citi Unveils Strategic Expansion of Citi Token Services: Euro Integration Advances 24/7, Multi-Currency Liquidity and Payment Solutions Globally",C,0.97
Where Will Micron Technology Stock Be in 1 Year?,MU,0.97
Why Micron Stock Rocketed 34% Higher in October,MU,0.97
Micron: Too Cheap To Stop Buying,MU,0.97
Best Growth Stocks to Buy for Nov. 7,MU,0.12
Is There a Future for Target?,TGT,0.96
Target This Quantum Computing Stock Before Another Rally,TGT,0.02
My Ultimate Blueprint For The Next 5 Years Of Income Investing,PLD,0.07
Getting Defensive: 3 Dividend Payers Reporting Strong Q3 Earnings,ELV,0.12
Zoetis: Why I'm Still Holding The Stock But Advise Against New Positions,ZTS,0.96
Opinion | Ford's Electric Pickup Is an EV Casualty,F,0.97
Will U.S. Tariffs and Emission Policies Boost Ford's Edge?,F,0.95
Ford May Dump F-150 Lightning,F,0.97
Gilead's breast cancer drug fails to meet main goal of late-stage study,GILD,0.97
Gilead Provides Update on Phase 3 ASCENT-07 Study,GILD,0.97
