headline,ticker,relevance
"Microsoft, Nvidia and Apple among top tech picks heading into year-end: Wedbush",TSLA,0.1
Tesla: Doesn't Get Enough Praise By Retail Investors,TSLA,0.94
Wall Street sets Tesla stock price for the next 12 months,TSLA,0.97
Tesla European Sales Drop Nearly 50% in October as BYD Expands Market Share,TSLA,0.96
Tesla Europe Sales Crash 48% -- BYD Triples Sales in Aggressive Takeover,TSLA,0.97
"Elon Musk-Led Boring Company To Open 1st Tunnel To Las Vegas Airport In 2026, With Capacity To Transport 20K People/Hour",TSLA,0.12
2 Things Every Tesla Investor Needs to Know,TSLA,0.97
"Amid Tesla Self Driving's European Expansion Buzz, Dutch Auto Regulator RDW Responds: 'Safety Is Paramount'",TSLA,0.96
Bernie Sanders Pushes Back On Trump Moves To Strip AI Powers From States: 'It Will Make The Oligarchs Richer While Millions Lose Jobs',TSLA,0.12
"Market Today: Stocks Rise on Fed Cut Bets; Alphabet, Apple Hit Records",AVGO,0.12
Broadcom Might Be The Biggest Winner From The 'GPU To TPU' AI Shift,AVGO,0.94
Today's Market: Nasdaq Sinks as Nvidia Suffers Worst Drop in Weeks on Meta--Google Report,AVGO,0.12
Broadcom Inc. (AVGO) Soars 11.1%: Is Further Upside Left in the Stock?,AVGO,0.97
Nvidia or Broadcom: Which AI Stock To Bet On?,AVGO,0.93
3 AI Infrastructure Stocks to Buy Right Now,AVGO,0.28
"AVGO, MU and AMD Forecast – Semiconductors All Over the Place in Premarket",AVGO,0.95
AVGO Stock To $700 Amid Google Partnership?,AVGO,0.97
Advisors Asset Management Inc. Reduces Stake in Broadcom Inc. $AVGO,AVGO,0.95
Atalanta Sosnoff Capital LLC Boosts Stock Position in Broadcom Inc. $AVGO,AVGO,0.93
Aviso Financial Inc. Increases Stock Holdings in Broadcom Inc. $AVGO,AVGO,0.93
Why Broadcom (AVGO) Shares Are Moving Higher?,AVGO,0.97
"Market Today: Stocks Rise on Fed Cut Bets; Alphabet, Apple Hit Records",LLY,0.12
AI Just Sparked Biotech's Biggest Rally Since 2004 — Why Isn't Anyone Talking About It?,LLY,0.18
A Trillion-Dollar Pill: Eli Lilly Broke the Healthcare Ceiling,LLY,0.96
Advisors Asset Management Inc. Has $18.78 Million Position in Eli Lilly and Company $LLY,LLY,0.95
"FDIC-Insured Banks' Q3 Earnings Rise, Asset Quality Improves",JPM,0.63
Buy 5 Old Economy Stocks on a Rally in 2025 for More Gains in 2026,JPM,0.12
Beta Wealth Group Inc. Sells 227 Shares of JPMorgan Chase & Co. $JPM,JPM,0.93
Bell Investment Advisors Inc Increases Stake in JPMorgan Chase & Co. $JPM,JPM,0.96
Alberta Investment Management Corp Lowers Holdings in JPMorgan Chase & Co. $JPM,JPM,0.95
Avantax Advisory Services Inc. Has $95.26 Million Holdings in JPMorgan Chase & Co. $JPM,JPM,0.95
Visa and Aquanow Partner on Stablecoin Settlement Across CEMEA Region,V,0.94
3 High-Quality Stocks Getting Stomped by the Market. Time to Buy?,V,0.06
Visa Inc. (V) is Attracting Investor Attention: Here is What You Should Know,V,0.97
Visa: The Cash Machine Trading At A Historical Discount,V,0.95
Thredd Signs Landmark Agreement to Enable Visa Cloud Connect Globally,V,0.96
"Market Today: Stocks Rise on Fed Cut Bets; Alphabet, Apple Hit Records",MA,0.12
Is MA Using Beauty Commerce to Unlock Its Next SME Growth Wave?,MA,0.96
Mastercard Launches Access Pass in UAE to Deepen Consumer Engagement,MA,0.95
Mastercard Incorporated $MA Shares Acquired by Aviso Financial Inc.,MA,0.97
"Associated Banc Corp Sells 1,802 Shares of Mastercard Incorporated $MA",MA,0.92
Is UNH's Hybrid Care Strategy Reshaping the Health System Playbook?,UNH,0.97
"Bank Julius Baer & Co. Ltd Zurich Has $144,000 Stake in UnitedHealth Group Incorporated $UNH",UNH,0.95
UnitedHealth Group Incorporated $UNH Shares Sold by Aviso Financial Inc.,UNH,0.95
XOM Halts Plans for Massive Blue Hydrogen Plant Amid Weak Demand,XOM,0.96
My Biggest Energy Call In Years - And Almost Everyone Is Missing It,XOM,0.12
Armor Investment Advisors LLC Lowers Holdings in Exxon Mobil Corporation $XOM,XOM,0.94
"P&G to Webcast Presentation From the Morgan Stanley Global Consumer & Retail Conference, December 2",PG,0.97
Aviso Financial Inc. Has $4.90 Million Holdings in Procter & Gamble Company (The) $PG,PG,0.93
Associated Banc Corp Has $37.23 Million Stock Holdings in Procter & Gamble Company (The) $PG,PG,0.95
"Market Today: Stocks Rise on Fed Cut Bets; Alphabet, Apple Hit Records",HD,0.05
The Home Depot to Host 2025 Investor and Analyst Conference on December 9,HD,0.95
"Aviso Financial Inc. Grows Stake in The Home Depot, Inc. $HD",HD,0.95
"Associated Banc Corp Sells 327 Shares of The Home Depot, Inc. $HD",HD,0.56
"Market Today: Stocks Rise on Fed Cut Bets; Alphabet, Apple Hit Records",MRK,0.05
"Associated Banc Corp Has $8.35 Million Stock Position in Merck & Co., Inc. $MRK",MRK,0.92
AbbVie and adMare BioInnovations Foster Life Sciences Innovation with the Launch of the AbbVie Biotech Innovators Award in Quebec,ABBV,0.96
Advisors Asset Management Inc. Has $13.75 Million Stock Position in AbbVie Inc. $ABBV,ABBV,0.95
AbbVie Inc. $ABBV Shares Bought by Aviso Financial Inc.,ABBV,0.95
Associated Banc Corp Has $6.43 Million Holdings in AbbVie Inc. $ABBV,ABBV,0.95
Costco Wholesale Corporation $COST Stock Position Lifted by Aviso Financial Inc.,COST,0.95
"FDIC-Insured Banks' Q3 Earnings Rise, Asset Quality Improves",BAC,0.62
Which Big Bank Stock is Set to Gain More From Rate Cuts: BAC or WFC?,BAC,0.97
Is Trending Stock Adobe Inc. (ADBE) a Buy Now?,ADBE,0.97
"American Century Companies Inc. Sells 78,184 Shares of Adobe Inc. $ADBE",ADBE,0.95
AXQ Capital LP Takes Position in Adobe Inc. $ADBE,ADBE,0.95
5 Soft Drink Stocks to Hold Their Ground As Cost Pressures Mount,KO,0.83
CocaCola Company (The) $KO Shares Bought by Aviso Financial Inc.,KO,0.97
"Associated Banc Corp Sells 5,544 Shares of CocaCola Company (The) $KO",KO,0.93
5 Soft Drink Stocks to Hold Their Ground As Cost Pressures Mount,PEP,0.78
3 Top Stocks to Buy This Holiday Season,PEP,0.12
"Aviso Financial Inc. Has $29.04 Million Stock Holdings in PepsiCo, Inc. $PEP",PEP,0.95
"Associated Banc Corp Sells 7,091 Shares of PepsiCo, Inc. $PEP",PEP,0.92
Oracle (ORCL) Stock Declines While Market Improves: Some Information for Investors,ORCL,0.97
Oracle Commodity Holding Receives Final Approval for the Amended Royalty Agreements with Silver Elephant,ORCL,0.05
Oracle Shares Rise Over 5% After Key Trading Signal,ORCL,0.97
Why Oracle Stock Sank Today,ORCL,0.97
"Jensen Huang Says “AI is Going Everywhere, Doing Everything,”—Time to Get Back Into the Oversold AI Stocks?",ORCL,0.25
Missed the AI Boom? These 2 Crushed Stocks Could Be Your Second Chance,ORCL,0.12
"The Big 3: GOOGL, NVDA, ORCL",ORCL,0.95
"Dow Stays Hot, Shrugs Off Big Tech Volatility",ORCL,0.12
Will Oracle's NetSuite Division Accelerate Revenue Growth?,ORCL,0.95
"Nvidia stock falls, bitcoin continues to struggle, Oracle's place in the AI race",ORCL,0.93
ORCL Earnings More Important Than NVDA? A.I. Spend Takes Over Trade,ORCL,0.97
Oracle And Nvidia Team Up To Power Abu Dhabi's Push For 'Sovereign AI',ORCL,0.96
How Low Can Oracle Stock Sink?,ORCL,0.97
3 Ways Oracle's OpenAI Deal Could Play Out. Only 1 Looks Good for the Stock.,ORCL,0.95
First Eagle Global Equity ETF Q3 2025 Portfolio Update,ORCL,0.05
"Aviso Financial Inc. Acquires 1,985 Shares of Oracle Corporation $ORCL",ORCL,0.93
Netflix steps up charm offensive to buy Warner Bros. Discovery even after Trump favors rival bid from Paramount,NFLX,0.97
"US midday market brief: Nvidia weakness, Alphabet strength; what this rotation means for Q4",NFLX,0.12
3 Reasons Why I'm Thankful to Be a Netflix Shareholder,NFLX,0.95
Can Netflix's Streaming Pipeline Spark Holiday Growth in the Stock?,NFLX,0.97
Alger American Asset Growth Fund Q3 2025 Portfolio Review,NFLX,0.08
Netflix sends off 'Stranger Things' with bike rides and product blitz,NFLX,0.96
HPE vs. CSCO: Which Networking Stock Has an Edge Right Now?,CSCO,0.94
Cisco to Participate in December 2025 Events with the Financial Community,CSCO,0.96
"Associated Banc Corp Boosts Stock Position in Cisco Systems, Inc. $CSCO",CSCO,0.94
Nvidia Denies Enron Comparisons: Newman Slams Bear Thesis On Accounting Issues As 'Garbage',CSCO,0.05
"Bank Julius Baer & Co. Ltd Zurich Sells 121,373 Shares of Thermo Fisher Scientific Inc. $TMO",TMO,0.95
Thermo Fisher Scientific Inc. $TMO Shares Bought by Aviso Financial Inc.,TMO,0.95
Here's Why Accenture (ACN) is a Strong Value Stock,ACN,0.97
Accenture PLC $ACN Shares Sold by Bank Julius Baer & Co. Ltd Zurich,ACN,0.97
Aviso Financial Inc. Sells 858 Shares of Accenture PLC $ACN,ACN,0.95
Bill Nygren's Strategic Moves: Centene Corp Exits with a -2.14% Impact,CRM,0.04
First Eagle Global Equity ETF Q3 2025 Portfolio Update,CRM,0.12
Is This the Best Value Stock to Buy While Markets Are Volatile?,PFE,0.05
"Want Over $7,000 in Annual Dividends? Invest $25,000 in Each of These 4 Stocks.",PFE,0.12
JNJ Stock vs. PFE Stock: Which Pharmaceutical Giant Is A Better Buy?,PFE,0.95
"AXQ Capital LP Buys Shares of 12,829 Pfizer Inc. $PFE",PFE,0.95
"Cathie Wood Makes Massive Google Stock Purchase Amid AI Chip Shakeup — Ark Loads Up On Meta, Sells Palantir And AMD Shares",AMD,0.95
Will AMD Be a $1 Trillion Company By 2028?,AMD,0.97
"S&P 500 Gains and Losses Today: Nvidia, AMD Slide After Report of Google AI Chip Deal; Best Buy Stock Jumps",AMD,0.93
"Why NVDIA, AMD and Super Micro Computer Are Down Big Today",AMD,0.95
"Google, Meta Rises As Nvidia Sinks; AI ETFs Caught In A Rare Big-Tech Vs. Theme Trade Split",AMD,0.75
"Small Caps, Pharma Surge As AI Rotation Broadens, Nvidia Tumbles: What's Moving Markets Tuesday?",AMD,0.78
Why a December Fed Cut Will Reignite the 2025 Bull Market,AMD,0.18
Abacus Global Management sets first annual dividend,AMD,0.07
Why AMD Stock Just Crashed,AMD,0.95
"MustGrow Biologics eyes strong finish to 2025 as it grows revenue, margins during Q3",AMD,0.02
MustGrow Biologics taps into the power of mustard to defend crops,AMD,0.02
"This Morning, Wall Street is Bullish on AMAT, NVDA and AAPL",AAPL,0.95
Alphabet's threat to Nvidia as Meta reportedly considers Google AI chips,NVDA,0.86
"Meta in talks to use Google's AI chips in data centers, Nvidia stock falls",NVDA,0.82
Alphawave shares rise as Qualcomm takeover clears key regulatory hurdles,QCOM,0.95
"Market Today: Stocks Rise on Fed Cut Bets; Alphabet, Apple Hit Records",AAPL,0.96
"Market is 'not that bad' as Apple breaks out, says Strategas' Chris Verrone",AAPL,0.95
Apple Cuts Jobs Across Its Sales Organization,AAPL,0.97
"Apple Bull Case: Vertical Integration, AI Efficiency, & a Huge Cash Stack",AAPL,0.97
"Apple CEO Tim Cook's potential successors include four top execs including iPhone, Mac guru",AAPL,0.97
"Small Caps, Pharma Surge As AI Rotation Broadens, Nvidia Tumbles: What's Moving Markets Tuesday?",AAPL,0.12
"Apple stock at all-time high: layoffs, iPhone 17 success, and the race against Nvidia",AAPL,0.97
Apple And Google Ordered To Block Gov Impersonation Scams,AAPL,0.95
Apple (AAPL) Stock Rises 2% -- Breaks New Record Levels,AAPL,0.97
Abacus Global Management sets first annual dividend,AAPL,0.02
GOOGL Eyes $4T Club: META's TPU Deal Adds Bullish Momentum,AAPL,0.08
"MustGrow Biologics eyes strong finish to 2025 as it grows revenue, margins during Q3",AAPL,0.02
MustGrow Biologics taps into the power of mustard to defend crops,AAPL,0.0
Disney vs. Apple: Which Media-Tech Giant Has Better Upside Potential?,AAPL,0.95
Alphabet's stock is getting closer to this huge milestone. Why Apple should watch out.,AAPL,0.78
"Microsoft, Nvidia and Apple among top tech picks heading into year-end: Wedbush",AAPL,0.95
Is Trending Stock Apple Inc. (AAPL) a Buy Now?,AAPL,0.95
T-Mobile Unwraps the Ultimate Apple Bundle — All on Us for Black Friday,AAPL,0.95
Opinion: Apple Has a Good Shot to Outperform as the AI Boom Runs Out of Steam,AAPL,0.93
Trump's $21 Trillion Boom: Hype or Historic Windfall?,AAPL,0.05
"Apple, Taiwan Semiconductor Manufacturing And More On CNBC's 'Final Trades'",AAPL,0.93
Apple Inc. $AAPL Position Increased by 180 Wealth Advisors LLC,AAPL,0.95
Apple Inc. $AAPL Shares Bought by Asset Management One Co. Ltd.,AAPL,0.93
Apple slashes sales jobs amid strategic restructuring,AAPL,0.97
Apple and Alphabet Ordered by Singapore to Curb Government Spoofing on Messaging Apps,AAPL,0.95
Apple Inc. $AAPL Stake Boosted by Cardinal Point Capital Management ULC,AAPL,0.96
"First Business Financial Services Inc. Sells 1,562 Shares of Apple Inc. $AAPL",AAPL,0.91
"Catalyst Capital Advisors LLC Sells 13,527 Shares of Apple Inc. $AAPL",AAPL,0.95
Apple Inc. $AAPL Shares Sold by Carnegie Investment Counsel,AAPL,0.93
Apple Inc. $AAPL Shares Acquired by Caitong International Asset Management Co. Ltd,AAPL,0.95
Polish antitrust watchdog investigates Apple over privacy policy,AAPL,0.95
"Singapore orders Apple, Google to prevent government spoofing on messaging platforms",AAPL,0.97
"Dan Ives Pounds The Table On Meta, Microsoft",MSFT,0.93
Standards + Excelerate Copilots from Standards Core Now Available in the Microsoft Marketplace,MSFT,0.94
Abacus Global Management sets first annual dividend,MSFT,0.02
"MustGrow Biologics eyes strong finish to 2025 as it grows revenue, margins during Q3",MSFT,0.02
MustGrow Biologics taps into the power of mustard to defend crops,MSFT,0.02
A New AI Beast Is Here: Alphabet Topples Microsoft In A Stunning November Rally,MSFT,0.95
"If The AI Bubble Bursts, I Want To Own Microsoft",MSFT,0.95
Nvidia shares fall as report suggests Meta may shift to Google's AI chips,NVDA,0.88
"Microsoft, Nvidia and Apple among top tech picks heading into year-end: Wedbush",MSFT,0.95
The Tech Stock Warren Buffett Wishes He'd Bought,MSFT,0.05
Anthropic Rolls Out Claude Opus 4.5 With Big Performance Gain,MSFT,0.78
Why rural Wisconsin is blocking the AI data center boom: 'Horses are skittish',MSFT,0.33
1 Unstoppable Artificial Intelligence (AI) Stock to Buy Before It Soars Into the $5 Trillion Club,MSFT,0.12
Microsoft Corporation $MSFT Shares Sold by First Business Financial Services Inc.,MSFT,0.93
Microsoft Corporation $MSFT Shares Sold by Carlton Hofferkamp & Jenks Wealth Management LLC,MSFT,0.95
CNB Bank Has $14.88 Million Holdings in Microsoft Corporation $MSFT,MSFT,0.97
Microsoft Corporation $MSFT Shares Bought by DDD Partners LLC,MSFT,0.95
Caitong International Asset Management Co. Ltd Makes New Investment in Microsoft Corporation $MSFT,MSFT,0.95
Catalyst Capital Advisors LLC Cuts Position in Microsoft Corporation $MSFT,MSFT,0.96
UNICEPTA Launches Integration with Microsoft 365 Copilot to Simplify Reputation Intelligence,MSFT,0.93
"Cathie Wood Pushes Back On Bubble Narrative, Says AI Boom 'Has Just Begun' And We're In The 'First Inning'",MSFT,0.12
"FAA probes Amazon after delivery drone snaps internet cable in Texas, CNBC reports",AMZN,0.93
Amazon faces FAA probe after delivery drone snaps internet cable in Texas,AMZN,0.95
"Ellerbroek: ""So Many Strengths"" in GOOGL A.I., AMZN ""Most Underappreciated"" Play",AMZN,0.95
The AI Bubble Theory Breaks When Amazon's Growth Refuses To Slow Down,AMZN,0.97
"Kyle Skalisky's A Sky Less Traveled Hits #1 on Amazon, Showcasing a Powerful Leadership Journey from Fighter Pilot to Aerospace Executive",AMZN,0.12
Amazon Leo is ready for testing and aimed squarely at Starlink's dominance,AMZN,0.97
"Ranking the Best ""Magnificent Seven"" Stocks to Buy for 2026. Here's My No.",AMZN,0.18
Why a December Fed Cut Will Reignite the 2025 Bull Market,AMZN,0.12
Oracle And Nvidia Team Up To Power Abu Dhabi's Push For 'Sovereign AI',AMZN,0.78
CRWV vs. AMZN: Which Cloud AI Infrastructure Stock is the Better Buy?,AMZN,0.95
OnAudience Announces New Integration with Amazon Ads to Supercharge AI-Driven Audience Targeting,AMZN,0.9
"Retail earnings, the new AI leaders, Amazon's $50 billion investment and more in Morning Squawk",AMZN,0.95
"Amazon Exec Drops Bold 2026 Tech Predictions— Companion Robots, Quantum Threats And A New Breed Of Developers",AMZN,0.95
Panasonic's energy unit to supply auto batteries to Amazon's Zoox from 2026,AMZN,0.93
Amazon Pushes Engineers Toward In-House Kiro AI Coding Tool Over Third-Party Options,AMZN,0.95
"Buckhead Capital Management LLC Has $6.23 Million Position in Amazon.com, Inc. $AMZN",AMZN,0.93
"Carret Asset Management LLC Boosts Stock Position in Amazon.com, Inc. $AMZN",AMZN,0.95
"Amazon.com, Inc. $AMZN Shares Sold by Field & Main Bank",AMZN,0.95
"Aljian Capital Management LLC Sells 9,784 Shares of Amazon.com, Inc. $AMZN",AMZN,0.95
"Amalgamated Bank Has $448.34 Million Position in Amazon.com, Inc. $AMZN",AMZN,0.95
E-Commerce Adoption Still Has 83.7% to Go: Buy This Market Leader Now,AMZN,0.12
Would You Like a New Car With That $8 USB Cable? Amazon Hopes So.,AMZN,0.93
"Adell Harriman & Carpenter Inc. Has $46.99 Million Position in Amazon.com, Inc. $AMZN",AMZN,0.94
Why Did Amazon Sell Its IonQ Stock?,AMZN,0.97
3 Leading Tech Stocks to Buy in 2025,AMZN,0.18
"Atria Investments Inc Decreases Stock Holdings in Amazon.com, Inc. $AMZN",AMZN,0.95
"The Ultimate Growth Stock to Buy With $1,000 Right Now",AMZN,0.05
Amazon Stock Is Rising Monday -- Here's Why?,AMZN,0.97
"Amazon Orders Staff To Ditch Rival AI Coding Tools As It Pushes Kiro To Close Gap With OpenAI, Google",AMZN,0.97
atom11 Wins the AI Innovation Award at Amazon Partner Awards 2025,AMZN,0.35
Bernie Sanders Pushes Back On Trump Moves To Strip AI Powers From States: 'It Will Make The Oligarchs Richer While Millions Lose Jobs',AMZN,0.12
CNBC Daily Open: Nvidia's crown looks increasingly uneasy on its head,NVDA,0.95
Guess Who Just Bought Nvidia Stock? An Investor Who Favors Innovators and Leads a Fund That's Climbed 100% Over 3 Years.,NVDA,0.95
Jim Cramer on why he is sticking by Nvidia,NVDA,0.96
Nvidia: The Cycle That Never Ends,NVDA,0.95
"Market Today: Stocks Rise on Fed Cut Bets; Alphabet, Apple Hit Records",NVDA,0.12
Meta Is in Talks to Use Google's Chips in Challenge to Nvidia,NVDA,0.82
AI Trade Splinters as Google Challenges Nvidia's Dominance,NVDA,0.97
Google Vs. Nvidia: Trillions Of Dollars At Play,NVDA,0.95
"Nvidia Is A 'Generation Ahead,' But 'Delighted' For Google",NVDA,0.95
"Why NVDIA, AMD and Super Micro Computer Are Down Big Today",NVDA,0.97
Nvidia name-checks Michael Burry in secret memo pushing back on AI bubble,NVDA,0.95
"Google, Meta Rises As Nvidia Sinks; AI ETFs Caught In A Rare Big-Tech Vs. Theme Trade Split",NVDA,0.97
"Nvidia Enron allegations explained: what Michael Burry, CoreWeave and the memo really mean",NVDA,0.95
GOOGL vs. NVDA: Is There a New Leader in AI?,NVDA,0.97
Nvidia Stock Drops on Rumored Google–Meta Chip Deal. Should Investors Be Worried?,NVDA,0.95
The One AI Risk Nvidia Bulls Keep Pretending Isn't Real,NVDA,0.93
Nvidia says it's 'delighted by Google's success' — but 'Nvidia is a generation ahead of the industry',NVDA,0.97
Nvidia responds after Meta opts for Google chips; What's next for NVDA stock?,NVDA,0.96
"Nvidia stock slumps on Google's AI chip growth news, how to prepare your portfolio for December",NVDA,0.95
Nvidia's Business Is Booming. Its Stock Is Falling.,NVDA,0.97
Nvidia says its GPUs are a 'generation ahead' of Google's AI chips,NVDA,0.97
"Small Caps, Pharma Surge As AI Rotation Broadens, Nvidia Tumbles: What's Moving Markets Tuesday?",NVDA,0.96
Nvidia's stock drops on Google fears. Are investors missing the point?,NVDA,0.97
Nvidia fell on reports Meta may tap Google for AI chips - why investors may be overreacting.,NVDA,0.82
Nvidia Sinks After Threat From Alphabet Emerges -- Is the Stock a Buy Now?,NVDA,0.95
"Top Stock Movers Now: Nvidia, Coinbase, Kohl's, and More",NVDA,0.96
AMG Yacktman Fund Q3 2025 Contributors And Detractors,NVDA,0.06
Nvidia shares sink 4% after report of Meta in talks to spend billions on Google chips,NVDA,0.97
Is This Nvidia's Next Trillion-Dollar Opportunity?,NVDA,0.96
"The Big 3: GOOGL, NVDA, ORCL",NVDA,0.95
Why a December Fed Cut Will Reignite the 2025 Bull Market,NVDA,0.17
Today's Market: Nasdaq Sinks as Nvidia Suffers Worst Drop in Weeks on Meta--Google Report,NVDA,0.97
"Nvidia stock is down 6%, but Jim Cramer remains bullish on the ‘AI darling'",NVDA,0.97
Abacus Global Management sets first annual dividend,NVDA,0.05
"MustGrow Biologics eyes strong finish to 2025 as it grows revenue, margins during Q3",NVDA,0.02
MustGrow Biologics taps into the power of mustard to defend crops,NVDA,0.02
"Nvidia stock falls, bitcoin continues to struggle, Oracle's place in the AI race",NVDA,0.97
"Dow extends rebound, closes higher as markets bet on December rate cut",NVDA,0.12
Best Momentum Stocks to Buy for Nov. 25,NVDA,0.12
Good News for Nvidia Investors,NVDA,0.95
What's Behind The Drop In Nvidia Stock Today?,NVDA,0.97
Why Nvidia Stock Just Crashed,NVDA,0.97
Nvidia namechecks Michael Burry in secret memo pushing back on AI bubble allegations,NVDA,0.96
Oracle And Nvidia Team Up To Power Abu Dhabi's Push For 'Sovereign AI',NVDA,0.95
Nvidia or Broadcom: Which AI Stock To Bet On?,NVDA,0.95
"This Morning, Wall Street is Bullish on AMAT, NVDA and AAPL",NVDA,0.95
KG: Analyzing NVDA Volatility Impact & Retail Signals for FOMC,NVDA,0.96
"Microsoft, Nvidia and Apple among top tech picks heading into year-end: Wedbush",NVDA,0.96
Are These 3 Under-the-Radar AI Stocks the Next Big Growth Stories?,NVDA,0.05
Nasdaq opens lower as Nvidia and AMD slump after Meta-Google chip deal,NVDA,0.95
S&P500: Meta's Chip Plans Trigger Nvidia Selloff—Tech Stocks Rebalancing Today,NVDA,0.95
Alger American Asset Growth Fund Q3 2025 Portfolio Review,NVDA,0.12
Nvidia-Google AI Chip Battle Escalates,NVDA,0.97
3 AI Infrastructure Stocks to Buy Right Now,NVDA,0.28
"US equities split at open as Nvidia stock slips 4%: Nasdaq down 0.4%, Dow up 0.5%",NVDA,0.97
Nasdaq Futures Slip as AI-Induced Rally Cools Off,NVDA,0.82
"RedCloud's CEO Floyd To Join NVIDIA, Google, Amazon, At Exclusive AI Summits in Tokyo and Doha",NVDA,0.34
Nvidia: The Next Growth Frontier Is Sovereign AI,NVDA,0.96
Trump's $21 Trillion Boom: Hype or Historic Windfall?,NVDA,0.05
Google Just Hit the AI Accelerator--Is Nvidia's Reign Finally at Risk?,NVDA,0.95
5 Things to Know Before the Stock Market Opens,NVDA,0.05
GOOGL TPU vs NVDA CPU: The Latest Perceived Tech Battle,NVDA,0.95
Nvidia Slams Michael Burry's Claims of an AI Bubble and Faulty Accounting,NVDA,0.96
Nasdaq called lower as Nvidia set to slip after Meta-Google chip deal,NVDA,0.97
Why Nvidia stock is crashing today,NVDA,0.97
"Semtech Posts Mixed Q3 Results, Joins Zhihu, Nvidia And Other Big Stocks Moving Lower In Tuesday's Pre-Market Session",NVDA,0.93
NVIDIA (NASDAQ: NVDA) Price Prediction and Forecast 2025-2030 for November 25,NVDA,0.95
Anthropic Rolls Out Claude Opus 4.5 With Big Performance Gain,NVDA,0.18
Prediction: This Will Be Nvidia's Stock Price 12 Months From Now,NVDA,0.97
Dow pushes ahead as Nvidia and AMD slump after Meta-Google chip deal,NVDA,0.97
Fund manager who ‘pounded the table' to own Nvidia in 2017 now likes these AI stocks,NVDA,0.95
Nvidia shares slide on competition concerns amid Meta-Google chip reports,NVDA,0.95
Meta Just Shook Nvidia--And Google's Chip Dreams May Finally Be Real,NVDA,0.97
Nvidia Slips After Report of Meta Turning to Google for Billions in AI Chips,NVDA,0.95
Nvidia Stock Drops. Why Google Is a Growing Threat.,NVDA,0.94
"Is AI in a Bubble, or Is the Rest of the Economy About to Pop?",NVDA,0.24
What's Going On With Nvidia Stock?,NVDA,0.97
Wall Street Breakfast Podcast: Nvidia's Chip Reign Challenged,NVDA,0.97
Nasdaq Index: Nvidia Weakness Weighs on US Stocks as AI Chip News Hits Sentiment,NVDA,0.97
Meta in talks to use Google’s AI chips in data centers,NVDA,0.81
Is Nvidia Wrong About the AI Market?,NVDA,0.95
CEO Jensen Huang Just Delivered Fantastic News for Nvidia Investors,NVDA,0.97
"Fairfield Financial Advisors LTD Buys 2,191 Shares of NVIDIA Corporation $NVDA",NVDA,0.95
NVIDIA Corporation $NVDA Holdings Reduced by Fire Capital Management LLC,NVDA,0.95
Capital Investment Counsel LLC Sells 806 Shares of NVIDIA Corporation $NVDA,NVDA,0.95
Bull Oak Capital LLC Makes New Investment in NVIDIA Corporation $NVDA,NVDA,0.95
Ferguson Shapiro LLC Makes New Investment in NVIDIA Corporation $NVDA,NVDA,0.97
"Alibaba Faces Q2 Risks, Warns Analyst: Cites Nvidia Chip Ban, Declining Cash Flow Margins",NVDA,0.82
Artificial Intelligence Bubble? Not According to Nvidia's CEO Jensen Huang,NVDA,0.97
Nvidia says it's not Enron. Michael Burry makes a different dot-com parallel.,NVDA,0.95
White House Unveils Apollo-Like 'Genesis Mission' As Trump Orders Massive AI Overhaul To Boost Innovation,NVDA,0.82
Boyd Watterson Asset Management LLC OH Has $4.29 Million Stake in NVIDIA Corporation $NVDA,NVDA,0.96
Biltmore Family Office LLC Raises Stake in NVIDIA Corporation $NVDA,NVDA,0.95
Nvidia shares fall on report Meta will use Google AI chips,NVDA,0.95
This Nvidia Flex by the Company's CFO May Have Exposed a Massive Future Growth Weakness,NVDA,0.95
Aviso Financial Inc. Increases Stake in Visa Inc. $V,V,0.95
Why Google's Next AI Move Could Be Even More Important Than Its Search Engine Dominance,GOOGL,0.95
Google and Anthropic Drop AI Prices and Release New Models,GOOGL,0.95
"Ellerbroek: ""So Many Strengths"" in GOOGL A.I., AMZN ""Most Underappreciated"" Play",GOOGL,0.95
Meta Is in Talks to Use Google's Chips in Challenge to Nvidia,GOOGL,0.95
AI Trade Splinters as Google Challenges Nvidia's Dominance,GOOGL,0.95
Google Vs. Nvidia: Trillions Of Dollars At Play,GOOGL,0.96
"Nvidia Is A 'Generation Ahead,' But 'Delighted' For Google",GOOGL,0.93
Alphabet's threat to Nvidia as Meta reportedly considers Google AI chips,GOOGL,0.97
"Google, Meta Rises As Nvidia Sinks; AI ETFs Caught In A Rare Big-Tech Vs. Theme Trade Split",GOOGL,0.95
Alphabet is making its way to $4 trillion market cap,GOOGL,0.95
Why Alphabet Stock Moved Higher Again Today,GOOGL,0.97
GOOGL vs. NVDA: Is There a New Leader in AI?,GOOGL,0.94
Is Google About to Eat Nvidia's Lunch?,GOOGL,0.94
"Google, the sleeping giant in global AI race, is now “fully awake”",GOOGL,0.94
"AI narrative is shifting towards Google with its complete stack, says Plexo Capital's Lo Toney",GOOGL,0.95
