headline,ticker,relevance
Meta wins antitrust lawsuit over its acquisitions of WhatsApp and Instagram,META,0.97
"Meta wins FTC antitrust trial that focused on WhatsApp, Instagram",META,0.96
Arm Holdings Stock in Focus After Striking High-Impact Partnership With Nvidia,META,0.12
"Meta does not hold social media monopoly, judge rules",META,0.97
"Meta Platforms Drops 18% in a Month: Buy, Sell or Hold the Stock?",META,0.97
Meta Chief Revenue Officer Leaves to Form Own Startup,META,0.95
Meta Platforms Q3: Back To Accounting Basics,META,0.97
AI's great power grab continues in spite of bubble fears,META,0.22
AI’s great power grab continues in spite of bubble fears,META,0.18
Meta Platforms: Is Today's AI Cycle A Repeat Of The Metaverse Overbuild?,META,0.96
Meta Draws Attention as Analyst Says AI Roadmap Remains Underappreciated,META,0.95
Baron Opportunity Fund Q3 2025 Portfolio Update,META,0.12
"Meta: P/E 24 Means Failure, But Success Is Possible",META,0.97
10 Artificial Intelligence (AI) Infrastructure Stocks to Buy for the $400 Billion Buildout,META,0.12
How Bad Can Things Get For Meta Stock?,META,0.95
"The Best Stocks to Invest $1,000 in Right Now",META,0.12
"Atlas Legacy Advisors LLC Increases Stake in Meta Platforms, Inc. $META",META,0.96
"Bryn Mawr Trust Advisors LLC Raises Stock Position in Meta Platforms, Inc. $META",META,0.94
"Billionaire Stanley Druckenmiller Sold His Fund's Entire Stake in Palantir and Just Loaded Up on 3 of the Cheapest Members of the ""Magnificent Seven""",META,0.25
Tesla obtains permit to operate ride-hail service in Arizona,TSLA,0.97
"Elon Musk, Jensen Huang to talk AI at US-Saudi investment forum",TSLA,0.78
Better EV Stock: Lucid vs. Tesla,TSLA,0.95
Tesla gets approved to launch ride-hailing service in Arizona,TSLA,0.96
Stellantis Expands EV Charging Access with Tesla Supercharger Network Integration,TSLA,0.95
"Ben Sturgill Bullish on NVDA, GOOGL, AMZN & Sees $1,000 TSLA",TSLA,0.95
"Market Today: Tech Slide, Meta Win, AI Deals, WBD Bids",TSLA,0.12
Tesla receives ride-hailing permit in Arizona in last required step to launch robotaxi service,TSLA,0.97
Tesla receives permit to operate as a transportation network company in Arizona,TSLA,0.97
Tesla Shares Rise 3% To Intraday High After Key Trading Signal,TSLA,0.95
Why superior speed isn't selling EVs,TSLA,0.28
"Detroit Three CEOs, Tesla VP asked to testify at US Senate hearing",TSLA,0.93
"Nvidia Earnings Loom, Sending Tesla and Tech Stocks Lower",TSLA,0.58
BYD Blows Past Rivals as Tesla Silently Storms South America's Richest EV Market,TSLA,0.95
Tesla stock tumbles over 3% on Tuesday: are Robotaxi dreams fading fast?,TSLA,0.97
Tesla Wins Bid to Halt Class Action in Race Bias Case,TSLA,0.97
Baron Opportunity Fund Q3 2025 Portfolio Update,TSLA,0.12
How Does Tesla Make Money?,TSLA,0.97
"XPeng CEO Plays The Anti-Tesla Card: While Optimus Is Closed, IRON Goes Open Source",TSLA,0.95
Will Optimus And Physical AI Transform Tesla?,TSLA,0.97
Tesla Stock Falls. Why Nvidia Earnings Matter So Much for Musk.,TSLA,0.92
Tesla (NASDAQ:TSLA) Shares Up 1.1% on Analyst Upgrade,TSLA,0.95
"If You'd Invested $1,000 in Broadcom Stock 1 Year Ago, Here's How Much You'd Have Today",AVGO,0.97
NVDA: Chip Stocks Fall Ahead of Nvidia Earnings on AI Profit Concerns,AVGO,0.28
Citi Flags AMD as 'Top Chip' Powerhouse While Nvidia's Shine Fades,AVGO,0.12
Baron Opportunity Fund Q3 2025 Portfolio Update,AVGO,0.1
Here is What to Know Beyond Why Broadcom Inc. (AVGO) is a Trending Stock,AVGO,0.97
What Are 2 Great Tech Stocks to Buy Right Now?,AVGO,0.12
It's Best Time In 10 Years To Lock In Income: Our Picks,AVGO,0.12
10 Artificial Intelligence (AI) Infrastructure Stocks to Buy for the $400 Billion Buildout,AVGO,0.25
Broadcom Inc. $AVGO Stock Holdings Increased by Avantax Advisory Services Inc.,AVGO,0.94
Alger Growth & Income Fund Q3 2025 Portfolio Update,AVGO,0.12
Lilly's Donanemab Wins India Approval For Alzheimer's,LLY,0.97
Baron Opportunity Fund Q3 2025 Portfolio Update,LLY,0.12
Lilly to participate in Citi's 2025 Global Healthcare Conference,LLY,0.94
"Eli Lilly Stock To $1,330?",LLY,0.97
Bridger Management LLC Makes New $5.70 Million Investment in Eli Lilly and Company $LLY,LLY,0.96
Alger Growth & Income Fund Q3 2025 Portfolio Update,LLY,0.12
"Market Today: Tech Slide, Meta Win, AI Deals, WBD Bids",JPM,0.1
"The More They Drop, The More I Load Up",JPM,0.1
McKinsey's $5.2 Trillion AI Warning Collides With JPMorgan's Bubble Fears,JPM,0.94
Is JPMorgan's High-Single-Digit Revenue Growth Cycle Built to Last?,JPM,0.96
Investors Gain a New Way to Earn Monthly Distributions and Exposure to Common Shares of JPMorgan Chase & Co. as Purpose Launches Yield Shares (JPYS) ETF,JPM,0.97
Bensler LLC Buys 748 Shares of JPMorgan Chase & Co. $JPM,JPM,0.96
"Should You Invest $1,000 in Visa (V) Before the End of 2025?",V,0.97
Visa Inc. (V) Presents at Wells Fargo's 9th Annual TMT Summit Transcript,V,0.94
Is RS2's New Visa Status a Game-Changer for Europe's Card Market?,V,0.78
Why Visa is moving deeper into stablecoins with new pilot for businesses,V,0.95
Is Visa Stock a Millionaire Maker?,V,0.95
Beyond by RS2 Becomes a Principal Issuing Member of Visa,V,0.93
UnitedHealth Group Taps Former FDA Chief And Medicare Advisor To Board,UNH,0.97
What Could Ignite UNH Stock's Next Major Rally?,UNH,0.95
Former FDA commissioner Scott Gottlieb joins UnitedHealth board,UNH,0.94
"Scott Gottlieb, M.D., Joins UnitedHealth Group Board of Directors",UNH,0.95
Prediction: 1 Dirt Cheap Warren Buffett Stock That Will Be Worth More Than Palantir By 2030,UNH,0.05
Exxon Mobil - Better Returns Are Ahead,XOM,0.93
"Exxon joins Chevron in pursuing parts of Lukoil global empire, sources say",XOM,0.96
"Exxon Mobil to close Scottish chemical plant, citing high costs and challenging UK policies",XOM,0.96
3 Smart Defensive Stocks for an Uneasy Market,PG,0.12
SmartETFs Dividend Builder ETF (NYSEARCA:DIVS) Trading Down 0.9%  – Time to Sell?,PG,0.05
"Market Today: Tech Slide, Meta Win, AI Deals, WBD Bids",HD,0.05
Why Home Depot's Pain Could Be a Long-Term Investor's Gain,HD,0.97
S&P 500 Gains and Losses Today: Home Depot Slumps as Earnings Disappoint; Medtronic Stock Jumps,HD,0.97
Home Depot Stock Slips As Big Projects Dry Up: Renovation Recession,HD,0.97
Home Depot Says It's Seeing Homeowner 'Fatigue' That Is Cutting Into Projects,HD,0.96
"The Home Depot, Inc. (HD) Q3 2026 Earnings Call Transcript",HD,0.98
Home Depot Stock Falls After the Company Cut Its Earnings Outlook. Here's What Investors Need to Know.,HD,0.98
"Home Depot shares tumble after chain slashes outlook, warns of ‘consumer uncertainty'",HD,0.97
"Top Stock Movers Now: Home Depot, Cloudflare, Nvidia, and More",HD,0.94
Markets Await Factory Orders Report,HD,0.12
Home Depot Stock Slips on Q3 Earnings Miss and Soft FY25 EPS View,HD,0.97
HD Shaky Earnings Sets Unstable Floor for LOW Report,HD,0.96
Why Home Depot Stock Dropped Today,HD,0.96
Dow Jones Today: Stock Indexes Slide Further; Dow Drops 500 Points; Home Depot Shares Fall After Outlook Cut; Cloudflare Slips After Outage,HD,0.95
Home Depot Says Focus on B2B Fails to Boost Results,HD,0.97
Clear skies mean stormy sales for Home Depot,HD,0.94
Home Depot's Earnings Miss Estimates. Here's What It Says About the Housing Market,HD,0.97
Home Depot Misses Q3 EPS Expectations and Lowers FY26 Guidance,HD,0.96
Home Depot Stock Slides as Weak Demand Dings Earnings,HD,0.97
Home Depot (HD) Reports Q3 Earnings: What Key Metrics Have to Say,HD,0.97
"Home Depot misses third-quarter earnings expectations, cuts outlook",HD,0.97
Dow Falls Over 300 Points; Home Depot Posts Downbeat Earnings,HD,0.97
Home Depot Cuts Outlook as Home Improvements Slow Down,HD,0.97
"Dow, Nasdaq Futures Gap Lower as Tech Eyes More Losses",HD,0.12
"Home Depot CEO Issues Cautionary Comments On Housing Demand, Cuts Profit Outlook",HD,0.97
5 Things to Know Before the Stock Market Opens,HD,0.12
Dow Retailer Home Depot Extends Downtrend As Demand Shrivels. Lowe's On Deck.,HD,0.97
"S&P500: Tech Pullback, Bitcoin Drop and Home Depot Cut Hit US Indices Today",HD,0.96
"Helmerich and Payne, Invivyd, Home Depot And Other Big Stocks Moving Lower In Tuesday's Pre-Market Session",HD,0.94
Home Depot (HD) Lags Q3 Earnings Estimates,HD,0.97
Breakfast News: Bitcoin Falls Below $90k,HD,0.05
"Home Depot's stock drops as housing market weakness, lack of storms hurt demand",HD,0.97
Home Depot Cuts Outlook As Home Improvement Slowdown Continues,HD,0.97
Home Depot beats quarterly sales estimates,HD,0.97
The Home Depot anuncia resultados del tercer trimestre del año fiscal 2025; actualiza Guía para el año fiscal 2025,HD,0.97
The Home Depot Announces Third Quarter Fiscal 2025 Results; Updates Fiscal 2025 Guidance,HD,0.98
Home Depot will report earnings before the bell. Here's what to expect,HD,0.97
Home Depot Earnings Are Imminent; These Most Accurate Analysts Revise Forecasts Ahead Of Earnings Call,HD,0.95
Merck Writes a $9.2 Billion Check for a Flu Drug That Could Change Everything,MRK,0.9
"Drug Giant Merck Breaks Out Past New Buy Point; CME, Marathon Eye Entries",MRK,0.96
"Merck's Winrevair Success Extends Beyond Pulmonary Hypertension, Showing Promise In Complex Heart Condition",MRK,0.95
Merck Announces First-Quarter 2026 Dividend,MRK,0.97
Merck's WINREVAIR™ (sotatercept-csrk) Met Primary Endpoint in Phase 2 CADENCE Study in Adults With Combined Post- and Precapillary Pulmonary Hypertension (CpcPH) due to Heart Failure With Preserved Ejection Fraction (HFpEF),MRK,0.96
Merck Has Many Bullish Attributes (Technical Analysis),MRK,0.97
"Merck & Co., Inc. (NYSE:MRK) Receives $104.50 Average PT from Brokerages",MRK,0.95
AbbVie Announces U.S. FDA Approval of EPKINLY® (epcoritamab-bysp) in Combination with Rituximab and Lenalidomide for Relapsed or Refractory Follicular Lymphoma,ABBV,0.96
Here's How Neuroscience Drugs Aided AbbVie's Top-line Growth in Q3,ABBV,0.96
It's Best Time In 10 Years To Lock In Income: Our Picks,ABBV,0.12
"Market Today: Tech Slide, Meta Win, AI Deals, WBD Bids",BAC,0.12
Is It Worth Investing in Bank of America (BAC) Based on Wall Street's Bullish Views?,BAC,0.96
How Does Bank of America Plan to Achieve ROTCE Target of 16-18%?,BAC,0.95
BofA Report: 74% of Small and Mid-Sized Business Owners Expect Revenue to Increase in the Next Year,BAC,0.95
Avantax Advisory Services Inc. Lowers Stock Holdings in Adobe Inc. $ADBE,ADBE,0.93
"Can Coca-Cola's ""All-Weather"" Strategy Keep Earnings Bubbling?",KO,0.95
Monster insider trading alert for this Warren Buffett stock,KO,0.27
"Could Investing $10,000 in Coca-Cola Make You a Millionaire?",KO,0.95
3 Stocks That Could Be Easy Wealth Builders,KO,0.06
3 Stocks That Could Create Lasting Generational Wealth,PEP,0.06
It's Best Time In 10 Years To Lock In Income: Our Picks,PEP,0.05
"PepsiCo: Strong Fundamentals, Soft Volumes, And A Lot Riding On Q4",PEP,0.95
First Eagle Rising Dividend Fund Q3 2025 Portfolio Review,ORCL,0.12
Arm Holdings Stock in Focus After Striking High-Impact Partnership With Nvidia,ORCL,0.07
These Are the 3 Cheapest Big Tech AI Stocks: Time to Buy?,ORCL,0.12
Why Oracle And Salesforce Look Stronger Than Synopsys Right Now,ORCL,0.95
What Are the 3 Top Artificial Intelligence (AI) Stocks to Buy Right Now?,ORCL,0.12
"NVDA Price Target Hike Ahead of Earnings, ORCL Cut, NET Outage",ORCL,0.94
ONC Certification of Oracle's AI-Powered EHR Marks Turning Point for the Healthcare Industry,ORCL,0.97
Titan Minerals posts further drilling results ahead of planned Q1 2026 Mineral Resource update,ORCL,0.02
Riversgold restarts drilling at Kalgoorlie Gold Project,ORCL,0.03
Cobalt Blue sharpens focus on battery recycling with Broken Hill pivot,ORCL,0.02
FireFly’s Green Bay resource grows 51% to 1.4Mt of copper and 1.1Moz of gold as high-grade core transforms project potential,ORCL,0.02
"Small Cap Watch: Firefly Metals, Aurum Resources, Nexus Minerals and more…",ORCL,0.0
Netflix Stock Price Lowers After 10-for-1 Split: Hold or Fold Now? (revised),NFLX,0.96
"Market Today: Tech Slide, Meta Win, AI Deals, WBD Bids",NFLX,0.12
Buying Netflix 10-for-1 Stock Split? Expect Underperformance,NFLX,0.97
AI's great power grab continues in spite of bubble fears,AMZN,0.27
"Lang: Uncertainty Dominating Volatility, NVDA Earnings Won't Meet High Bar",NVDA,0.96
"Microsoft, Nvidia to Invest Up to $15 Billion in Anthropic",NVDA,0.95
"Microsoft CEO of commercial business on Anthropic, Nvidia partnership",NVDA,0.95
Warren Buffett Keeps Selling His Apple Stock: Should You?,AAPL,0.96
Alger Growth & Income Fund Q3 2025 Portfolio Update,GOOGL,0.1
Home Depot misses profit view as weak demand drags on Q3 results,HD,0.95
Why Apple's stock is beating the market even as tech stocks sell off,AAPL,0.97
How Big Tech is faring against US antitrust lawsuits,AAPL,0.78
Check Your Streaming Bills. ‘Streamflation’ Could Be Costing You More Than You Think.,AAPL,0.28
"""Behind the Story Podcast"" Hits Top 33 in Apple Podcasts' Arts Category, Offering Entrepreneurs and Creators a Platform to Share Their Journeys",AAPL,0.95
Apple designer behind iPhone Air leaves company for AI startup,AAPL,0.92
"VOO vs SPYM: Same S&P 500 Returns, Different Share Prices",AAPL,0.06
"Klarna now available on Apple Pay in Denmark, Spain, and Sweden with France to follow",AAPL,0.94
QUBT Stock vs. AAPL Stock?,AAPL,0.95
Apple Stock in Focus -- Hitting 25% Share in China as New Models Outperform,AAPL,0.97
Apple Gains 25% Share of China Smartphone Market on iPhone 17 Demand,AAPL,0.95
Apple: As A Shareholder I Am Concerned About Their Ability To Innovate,AAPL,0.97
Apple Jumps to 25% Market Share in China,AAPL,0.97
"Dell, HPE Shares Fall After Morgan Stanley Warned Surging Memory Prices Could Hit Margins",AAPL,0.78
"Nike and Apple Both Went Public 45 Years Ago. Here's How Much $1,000 in Each Would Be Worth Today.",AAPL,0.97
Apple Inc. $AAPL Stock Position Trimmed by Goldstein Advisors LLC,AAPL,0.94
Apple takes 25% share of China smartphone market in October on iPhone 17 demand,AAPL,0.97
Alger Growth & Income Fund Q3 2025 Portfolio Update,AAPL,0.12
Trifork partners with Loft Dynamics to scale qualified pilot training on Apple Vision Pro,AAPL,0.93
Apple's iPhone 17 surge lifts China sales as design team faces fresh upheaval,AAPL,0.97
"Technical Tuesday: SPX, MSFT & BBY",MSFT,0.97
Trump DOE gives Microsoft partner $1B loan to restart Three Mile Island reactor,MSFT,0.21
Nvidia earnings are all about guidance; Microsoft and Nvidia invest in Anthropic,MSFT,0.95
Why This Expert Says 'We No Longer See a Bull Case' for These Two Magnificent 7 Stocks,MSFT,0.12
"Market Today: Tech Slide, Meta Win, AI Deals, WBD Bids",MSFT,0.12
Kore.ai Selected as Launch Partner for Microsoft Agent 365 to Accelerate Enterprise AI Adoption,MSFT,0.95
"The More They Drop, The More I Load Up",MSFT,0.05
Esri Introduces Latest ArcGIS Integrations for Microsoft Fabric,MSFT,0.93
Microsoft launches tracker to manage autonomous AI in the workplace,MSFT,0.95
Astera Labs' Leo CXL Smart Memory Controllers on Microsoft Azure M-series Virtual Machines Overcome the Memory Wall,MSFT,0.95
"Microsoft, Nvidia to Invest Up to $15 Billion in Anthropic",MSFT,0.97
Trump administration backs Three Mile Island nuclear restart with $1 billion loan to Constellation,MSFT,0.02
Tanium Security Triage Agent and Tanium Security Triage Agent with Identity Insights Now Generally Available in Microsoft Security Copilot,MSFT,0.94
"Microsoft CEO of commercial business on Anthropic, Nvidia partnership",MSFT,0.95
"Reply at Microsoft Ignite 2025: Showcasing AI Innovation, Copilot Experiences, and Intelligent Enterprise Solutions",MSFT,0.97
VAST Data Partners with Microsoft to Power the Next Wave of Agentic AI,MSFT,0.95
New Relic Introduces Agentic AI Integrations with Microsoft Azure to Reduce MTTR and Boost Developer Productivity,MSFT,0.93
Check Point Software Collaborates with Microsoft to Deliver Enterprise-Grade AI Security for Microsoft Copilot Studio,MSFT,0.96
OneStream Deepens Strategic Alliance with Microsoft to Accelerate AI Adoption and Value for Office of the CFO,MSFT,0.95
Quantexa Announces General Availability of Quantexa Unify for Microsoft Fabric,MSFT,0.92
"Cribl Expands Collaboration with Microsoft, Simplifies Real-Time Insights with Dedicated Microsoft Fabric Real-Time Intelligence Integration",MSFT,0.95
Varonis Announces New Microsoft Purview DSPM Integration,MSFT,0.93
Nerdio announces support for Microsoft Azure Virtual Desktop for hybrid environments to help on-premises VDI users modernize,MSFT,0.94
Secure Network Supervisor by Aviatrix® Now Generally Available in Microsoft Security Copilot,MSFT,0.93
ClickHouse Strengthens Collaboration with Microsoft through Microsoft OneLake Integration for Seamless Data Interoperability,MSFT,0.93
Cohesity Accelerates Significant Growth and Momentum in AI-Powered Data Security Through Microsoft Partnership,MSFT,0.78
"Cyera Secures the Agentic AI Era in Collaboration with Microsoft Purview, Sentinel, Entra, and Copilot Studio",MSFT,0.93
Nexla Partners with Microsoft to Supercharge Microsoft 365 Copilot with Access to 500-Plus Enterprise Data Sources,MSFT,0.96
Citrix Showcases Secure Work Innovations at Microsoft Ignite,MSFT,0.82
DevRev Launches Integration with Microsoft Fabric to Help Enterprises Unify Data for AI Workflows,MSFT,0.92
Microsoft Extends Losses After Earnings; Is The Magnificent Seven Leader A Sell Now?,MSFT,0.97
Zacks Investment Research Brings AI-Ready Equity Research to Microsoft 365 Copilot,MSFT,0.93
Nvidia and Microsoft Just Teamed Up For a Massive AI Deal. Is It The Latest Sign of an AI Bubble?,MSFT,0.95
Redburn Cuts Amazon And Microsoft On AI Payoff Worries,MSFT,0.94
New RSA Agent for Admin Threats Now Generally Available in Microsoft Security Copilot,MSFT,0.94
NVDA: Chip Stocks Fall Ahead of Nvidia Earnings on AI Profit Concerns,MSFT,0.28
Microsoft and Amazon stocks fall on rare downgrade questioning AI optimism,MSFT,0.96
Arm Holdings Stock in Focus After Striking High-Impact Partnership With Nvidia,MSFT,0.18
"Amazon, Microsoft Shares Slip as EU Opens Cloud Market Investigation",MSFT,0.96
"Why Are Amazon, Microsoft And Other Tech Stocks Down? AI Bubble Fears Cause Sell-Off",MSFT,0.96
EU Targets Amazon and Microsoft in Explosive Cloud Crackdown,MSFT,0.96
"Microsoft unveils new tool to help companies control, track AI agents",MSFT,0.95
Nvidia and Microsoft Land a Multibillion-Dollar Anthropic Partnership. Which Stock Benefits Most?,MSFT,0.94
Zenity Announces Inline Prevention for Microsoft Foundry and General Availability for Capabilities in Microsoft Copilot Studio,MSFT,0.95
"Redburn Analyst on His Call to Cut Microsoft, Amazon",MSFT,0.95
"Microsoft, Nvidia to Invest a Combined $15 Billion in Anthropic",MSFT,0.97
"Anthropic valued in range of $350B following investment deal with Microsoft, Nvidia",MSFT,0.95
Dow Jones Today: Stock Indexes Slide Further; Dow Drops 500 Points; Home Depot Shares Fall After Outlook Cut; Cloudflare Slips After Outage,MSFT,0.1
"Nvidia, Microsoft invest $15 billion in AI startup Anthropic",MSFT,0.96
Glean Integrates with Microsoft Agent 365 to Deliver Enterprise-Ready AI Where Microsoft 365 Users Work,MSFT,0.93
Sophos Integrates Advanced Cyber Intelligence into Microsoft Security Copilot and Microsoft 365 Copilot,MSFT,0.95
Sophos Recognized with Microsoft Verified Small and Medium Business (SMB) Solution Status,MSFT,0.92
"Nasdaq 100: Tech Sector Drops as AMD, Micron and Microsoft Pressure US Indices",MSFT,0.95
Why Amazon and Microsoft's stocks could be in trouble due to AI's destructive economics,MSFT,0.95
AI's great power grab continues in spite of bubble fears,MSFT,0.28
"The latest circular AI deal stars Anthropic, Nvidia, and Microsoft",MSFT,0.95
"The newest AI megadeal involves Microsoft, Nvidia, Anthropic — and $45 billion",MSFT,0.95
"Nvidia, Microsoft and Anthropic Commit to Roughly $45 Billion in AI Partnership",MSFT,0.96
"Microsoft unveils tool to help companies control, track AI agents",MSFT,0.97
Proofpoint Satori™ Emerging Threats Intelligence Agent Now Generally Available for Microsoft Security Copilot,MSFT,0.93
"Anthropic to buy $30 billion in Azure capacity in new deal with Microsoft, Nvidia",MSFT,0.97
AI’s great power grab continues in spite of bubble fears,MSFT,0.22
"Microsoft to invest $5B in Anthropic, as Claude maker commits $30B to Azure in new Nvidia alliance",MSFT,0.96
Anthropic to spend $30B in compute through Nvidia and Microsoft,MSFT,0.93
"VOO vs SPYM: Same S&P 500 Returns, Different Share Prices",MSFT,0.05
Why It's Time to Look at This Microsoft ETF,MSFT,0.94
"Microsoft and Alphabet Drive Surge in Carbon Removal Credit Demand, Fueling Supply Crunch",MSFT,0.95
Microsoft and Nvidia Unveil Massive AI Partnership With Anthropic,MSFT,0.97
Anthropic commits $30 billion to Microsoft Azure compute,MSFT,0.97
Baron Opportunity Fund Q3 2025 Portfolio Update,MSFT,0.12
Devolutions Unveils Secure AI Integration in Remote Desktop Manager at Microsoft Ignite,MSFT,0.12
Microsoft Corporation $MSFT Position Decreased by BKM Wealth Management LLC,MSFT,0.95
"Birmingham Capital Management Co. Inc. AL Has $907,000 Holdings in Microsoft Corporation $MSFT",MSFT,0.94
Qure.ai Partners With Microsoft to Increase Access to Its Lung Cancer Detection and Management Suite in the U.S.,MSFT,0.95
It's Best Time In 10 Years To Lock In Income: Our Picks,MSFT,0.05
BitTitan Showcases Next-Generation Migration Innovation at Microsoft Ignite 2025,MSFT,0.93
NinjaOne Announces Microsoft Intune Integration to Simplify Endpoint Management and Boost Productivity,MSFT,0.93
Atropos Health Launches the Atropos Evidence™ Agent with Microsoft Teams to Surface Personalized Evidence during Multidisciplinary Care Team Collaborations,MSFT,0.93
NinjaOne Named Microsoft RMM Partner for Windows 365 Business,MSFT,0.93
Microsoft: AI Winner Positioned To Break Out Higher,MSFT,0.96
10 Artificial Intelligence (AI) Infrastructure Stocks to Buy for the $400 Billion Buildout,MSFT,0.28
"Here Are Tuesday's Top Wall Street Analyst Research Calls: Alphabet, Amazon.com, Deckers Outdoors, DraftKings, Microsoft, Qualys, Zscaler and More",MSFT,0.95
"Amazon, Microsoft cloud services could face tougher EU rules",MSFT,0.95
Protiviti Receives 2025-2026 Microsoft AI Business Solutions Inner Circle Award,MSFT,0.24
Microsoft Corporation $MSFT is Balboa Wealth Partners’ 3rd Largest Position,MSFT,0.94
Aull & Monroe Investment Management Corp Has $4.88 Million Stock Holdings in Microsoft Corporation $MSFT,MSFT,0.97
"European Commission probes cloud computing services by Amazon, Microsoft for potential gatekeeping",MSFT,0.95
Microsoft CEO Satya Nadella Just Delivered Bad News to Artificial Intelligence Investors,MSFT,0.94
Microsoft Corporation $MSFT Position Raised by Calamos Wealth Management LLC,MSFT,0.95
Amazon: A Google-Like Run Is Imminent,AMZN,0.92
3 Stocks That Could Create Lasting Generational Wealth,AMZN,0.12
Why Amazon Stock Plummeted Today,AMZN,0.97
"Ben Sturgill Bullish on NVDA, GOOGL, AMZN & Sees $1,000 TSLA",AMZN,0.93
Why This Expert Says 'We No Longer See a Bull Case' for These Two Magnificent 7 Stocks,AMZN,0.2
"Market Today: Tech Slide, Meta Win, AI Deals, WBD Bids",AMZN,0.2
"The More They Drop, The More I Load Up",AMZN,0.12
Amazon Just Did This—and It Didn't End Well Last Time,AMZN,0.95
How Big Tech is faring against US antitrust lawsuits,AMZN,0.33
Redburn Cuts Amazon And Microsoft On AI Payoff Worries,AMZN,0.95
Amazon Raises $15 Billion As AI Buildout Intensifies,AMZN,0.97
NVDA: Chip Stocks Fall Ahead of Nvidia Earnings on AI Profit Concerns,AMZN,0.18
Microsoft and Amazon stocks fall on rare downgrade questioning AI optimism,AMZN,0.96
Arm Holdings Stock in Focus After Striking High-Impact Partnership With Nvidia,AMZN,0.62
"Amazon, Microsoft Shares Slip as EU Opens Cloud Market Investigation",AMZN,0.96
Amazon Launches $15 Billion Bond Sale to Accelerate AI Build-Out,AMZN,0.97
Amazon's Zoox launches robotaxi rides in San Francisco,AMZN,0.94
"Why Are Amazon, Microsoft And Other Tech Stocks Down? AI Bubble Fears Cause Sell-Off",AMZN,0.96
EU Targets Amazon and Microsoft in Explosive Cloud Crackdown,AMZN,0.93
"Amazon, Google named by EU among 'critical' tech providers for finance industry",AMZN,0.94
"Redburn Analyst on His Call to Cut Microsoft, Amazon",AMZN,0.95
Why Amazon and Microsoft's stocks could be in trouble due to AI's destructive economics,AMZN,0.96
Winn-Dixie expands Amazon return kiosks to 68 additional stores across Florida,AMZN,0.93
AI’s great power grab continues in spite of bubble fears,AMZN,0.18
Baron Opportunity Fund Q3 2025 Portfolio Update,AMZN,0.12
Amazon's Robotaxi Unit Launches In San Francisco Without Steering Wheels—Or Fees,AMZN,0.95
"Zoox begins offering robotaxi rides in San Francisco, facing off with Waymo",AMZN,0.97
10 Artificial Intelligence (AI) Infrastructure Stocks to Buy for the $400 Billion Buildout,AMZN,0.22
"Here Are Tuesday's Top Wall Street Analyst Research Calls: Alphabet, Amazon.com, Deckers Outdoors, DraftKings, Microsoft, Qualys, Zscaler and More",AMZN,0.95
Amazon joins AI-related debt blitz as pressure emerges in tech companies' credit spreads,AMZN,0.94
"Amazon, Microsoft cloud services could face tougher EU rules",AMZN,0.96
Wall Street Breakfast Podcast: Bitcoin Slides Below $90K,AMZN,0.06
Amazon stock hit with major Wall Street downgrade,AMZN,0.96
"European Commission probes cloud computing services by Amazon, Microsoft for potential gatekeeping",AMZN,0.95
"Blue Sky Capital Consultants Group Inc. Buys 898 Shares of Amazon.com, Inc. $AMZN",AMZN,0.92
"Billionaire Stanley Druckenmiller Sold His Fund's Entire Stake in Palantir and Just Loaded Up on 3 of the Cheapest Members of the ""Magnificent Seven""",AMZN,0.25
Amazon Plans $12 Billion U.S. Bond Sale to Fund Expanding AI Investments,AMZN,0.97
"Dow Jones & Nasdaq 100 Stabilize with Nvidia Earnings, FOMC Ahead",NVDA,0.96
"Elon Musk, Jensen Huang to talk AI at US-Saudi investment forum",NVDA,0.94
Nvidia Results and Delayed Jobs Data Set Up Critical Test for Wall Street,NVDA,0.97
